"url","product_name","product_rating","product_rating_object","product_rating_max","rating","author_name","asin","product_rating_count","review_header","review_id","review_text","author_id","author_link","badge","brand","review_posted_date","review_country","review_images","helpful_count","keyword","is_amazon_vine","is_verified","variant_asin","variant_name","videos"
"https://www.amazon.com/product-reviews/B00009RDIF?ie=UTF8&reviewerType=all_reviews&pageNumber=393","Panasonic Stereo Headphones with XBS Port, Integrated Volume Controller and Lightweight Foldable Design – RP-HT227-K – Over the Ear Headphones (Black & Silver)",4.3,"{""five_star"":17192,""four_star"":4954,""one_star"":1614,""three_star"":2747,""two_star"":1225}",5,5,"Mark **","B00009RDIF",27732,"love the long cord.","R2C25KCFW09EQB","Nice sound, long cord, good fit, good value","AENCXUHEYXEETXUIDXORJGJDCKAA","https://www.amazon.com//gp/profile/amzn1.account.AENCXUHEYXEETXUIDXORJGJDCKAA/ref=cm_cr_arp_d_gw_btm?ie=UTF8","Verified Purchase","Panasonic","February 18, 2020","United States",[],0,,,,,,
"https://www.amazon.com/Soundcore-Cancelling-Headphones-Bluetooth-Comfortable/dp/B09FPCZ318/ref=sr_1_106?keywords=headphones&qid=1676645373&sr=8-106","Soundcore by Anker Life Q35 Multi Mode Active Noise Cancelling Headphones, Bluetooth Headphones with LDAC for Hi Res Wireless Audio, 40H Playtime, Comfortable Fit, Clear Calls, for Home, Work, Travel",4.5,"{""five_star"":5382,""four_star"":1412,""one_star"":256,""three_star"":479,""two_star"":253}",5,3,"******","B09FPCZ318",7783,"Good value and features but annoying bug","R1Q1XLQ191W3ST","Pros:Reasonable cost-for-feature ratioComfortable; portableSound quality is good for price pointBluetooth connection non-problematicCon:Very annoying bug in which it pauses unpredictably and for no reason. Once it starts doing this it will do it every few seconds (IME) unless you turn off, restart and re-link the phones. Then after a while it starts doing it again. This happens in every mode. Really frustrating. For that reason alone I would not recommend them to anyone.","AEB65QZ3F2J7HKD6XOWHPF3XDPFQ","https://www.amazon.com//gp/profile/amzn1.account.AEB65QZ3F2J7HKD6XOWHPF3XDPFQ/ref=cm_cr_arp_d_gw_btm?ie=UTF8","Verified Purchase","Soundcore","December 29, 2022","United States",[],2,,,,,,
"https://www.amazon.com/Sony-WH-1000XM4-Canceling-Headphones-phone-call/dp/B0863TXGM3/ref=sr_1_41?keywords=headphones&qid=1676645343&sr=8-41","Sony WH-1000XM4 Wireless Premium Noise Canceling Overhead Headphones with Mic for Phone-Call and Alexa Voice Control, Black",4.7,"{""five_star"":38523,""four_star"":4627,""one_star"":1479,""three_star"":1540,""two_star"":819}",5,5,"Fla***76","B0863TXGM3",46980,"Comfortable, simple, and a joy to listen with","R2BHJBQFWMQBXI","The headphones themselves are great, the app allows you to have multiple devices connected simultaneously (so I can take a call on my work computer seamlessly while listening to Spotify on my phone without mucking with Bluetooth). The speech pass-through isn't as effortless as I'd like (the speech detection takes a few words to trigger and a second to flip modes) but Sony left in the ""cover the earpiece"" which I've realized is a TOUCH TRIGGERED and it's fast/responsive.","AGTEOLZPSTQH24OKJSYFU2ALMFTA","https://www.amazon.com//gp/profile/amzn1.account.AGTEOLZPSTQH24OKJSYFU2ALMFTA/ref=cm_cr_arp_d_gw_btm?ie=UTF8","Verified Purchase","Sony","September 27, 2021","United States",,0,,,,,,
"https://www.amazon.com/INFURTURE-Cancelling-Headphones-Wireless-Bluetooth/dp/B0B879C5DS/ref=sr_1_168?keywords=headphones&qid=1676645331&sr=8-168","INFURTURE Active Noise Cancelling Headphones, H1 Wireless Over Ear Bluetooth Headphones, Deep Bass Headset, Low Latency, Memory Foam Ear Cups,40H Playtime, for Adults, Kids, TV, Travel, Home Office",4.4,"{""five_star"":5581,""four_star"":1640,""one_star"":427,""three_star"":626,""two_star"":284}",5,2,"******","B0B879C5DS",8558,"Left ear keeps cutting out","RB9HKCPZWKUZ3","Honestly im super disappointed i bought this headset for the gym and i have had it for 3 days . The first day the left year speaker stopped working and i had to keep moving the headset around and then it would kick back in ... second day same thing. Third day as well. So basically its a waste of money . The disappointing thing is it is a nice looking headset, sounds great when both speakers work and the sound is great too thats why i gave it 2 stars.",,"https://www.amazon.com/undefined","Verified Purchase","INFURTURE","April 28, 2022","Germany",,0,,,,,,
"https://www.amazon.com/Conduction-Headphones-Waterproof-Sweatproof-Conducting/dp/B0BHQNLBQ3/ref=sr_1_303?keywords=headphones&qid=1676645334&sr=8-303","Bone Conduction Headphones,Bluetooth Wireless Open Ear Sport Headphone with Mic,Waterproof Sweatproof Conducting Headset Induction Earphones for Running,Cycling,Walking,Workout,Gym,Work(Black)",4.6,"{""five_star"":310,""four_star"":21,""one_star"":16,""three_star"":19,""two_star"":7}",5,5,"Mark *","B0BHQNLBQ3",373,"Perfect for their purpose","R3F735G498DX3V","I own a pair of Trek Aftershocks and these headphones do a good job of creating a cheaper version that's still functional. Of course, the build quality doesn't feel as solid, but it's only really noticeable in the buttons. They just feel cheaper, but that's fine because the price justifies it. Perfect for working in an office setting.","AGK6JNLZBYBYDLHVURD4LXCFFIAQ","https://www.amazon.com//gp/profile/amzn1.account.AGK6JNLZBYBYDLHVURD4LXCFFIAQ/ref=cm_cr_arp_d_gw_btm?ie=UTF8","Verified Purchase","Guudsoud","January 7, 2023","United States",,0,,,,,,
"https://www.amazon.com/Cancelling-Headphones-Lightweight-Srhythm-Bluetooth/dp/B07F62W3TQ/ref=sr_1_35?keywords=headphones&qid=1676645343&sr=8-35","Srhythm NC25 Active Noise Cancelling Headphones Bluetooth 5.0,ANC Stereo Headset Over-Ear with Hi-Fi,Mic,50H Playtime,Voice Assistant,Low Latency Game Mode",4.4,"{""five_star"":8701,""four_star"":2548,""one_star"":598,""three_star"":952,""two_star"":459}",5,5,"Kingsley E****t","B07F62W3TQ",13258,"Great Sound, Simple Controls, 6 Stars","RO9OMF3IOZ7U6","I love the fact that the ANC has its own  separate switch. For noise cancelling without having to have another input, for reducing airplane noise without having to listen to music or movies. All of the controls are Intuitive, Simple, Convenient. I haven't been able to assess the battery life yet, but so far, it seems pretty good.It is rugged with metal hinges to the ear pieces. LIGHT WEIGHT and doesn't squeeze  your head. It is comfortable and stays on without the headache you get from too tight. I give it 6 stars. To check sound quality I use YouTube video theme from Fist full of dollars by the Danish orchestra. Amazing. And No! No one offered any incentive. They are simply very well engineered.","AFDE4Q3BNEDGXDJDABSDCQXUWDWQ","https://www.amazon.com//gp/profile/amzn1.account.AFDE4Q3BNEDGXDJDABSDCQXUWDWQ/ref=cm_cr_arp_d_gw_btm?ie=UTF8","Verified Purchase","Srhythm","December 1, 2022","United States",,3,,,,,,
"https://www.amazon.com/Perytong-Headphones-Bluetooth-Headband-Headphone/dp/B0BK7YR1D3/ref=sr_1_248?keywords=headphones&qid=1676645334&sr=8-248","Perytong Sleep Headphones Bluetooth Headband Wireless Headphone Headband for Side Sleepers - Headphones for Sleeping - Sleeping Headphones for Insomnia Nuit Travel,Gift for Women Men Mom Dad",4.3,"{""five_star"":29376,""four_star"":8745,""one_star"":2102,""three_star"":4103,""two_star"":1714}",5,3,"******","B0BK7YR1D3",46035,"Very quiet","R3E59JAGYUSJD3","They are very quiet, have no noise canceling capability, and the controls are difficult, they’re okay if you’re in a quiet room but they’re not loud enough to cancel out any background noise","AEDHPST5Y326MKTSY6G5FBHIPWDQ","https://www.amazon.com//gp/profile/amzn1.account.AEDHPST5Y326MKTSY6G5FBHIPWDQ/ref=cm_cr_arp_d_gw_btm?ie=UTF8","Verified Purchase","Perytong","March 25, 2022","United States",[],0,,,,,,
"https://www.amazon.com/product-reviews/B00IT0IHOY?ie=UTF8&reviewerType=all_reviews&pageNumber=370","Sennheiser Professional HD 280 PRO Over-Ear Monitoring Headphones",4.6,"{""five_star"":7917,""four_star"":1661,""one_star"":403,""three_star"":608,""two_star"":360}",5,5,"Asfaq M***k M******i","B00IT0IHOY",10950,"Awesome an superb headphone","R1GXV3986GGZY2","Good for mixing or mastering in a budgets of 6k only.",,,"Verified Purchase","Sennheiser Pro Audio","November 4, 2022","Canada",[],0,,,,,,
"https://www.amazon.com/product-reviews/B09FT58QQP?ie=UTF8&reviewerType=all_reviews&pageNumber=492","TOZO A1 Mini Wireless Earbuds Bluetooth 5.3 in Ear Light-Weight Headphones Built-in Microphone, IPX5 Waterproof, Immersive Premium Sound Long Distance Connection Headset with Charging Case, Black",4.3,"{""five_star"":30807,""four_star"":9052,""one_star"":2628,""three_star"":4038,""two_star"":1790}",5,5,"Michael M****n","B09FT58QQP",48315,"Great","R3NLHTKBLFW7NN","Much better  than anticipated.  Great quality.","AHVFE6GAFDI3IDY5DYVX4GPAOONQ","https://www.amazon.com//gp/profile/amzn1.account.AHVFE6GAFDI3IDY5DYVX4GPAOONQ/ref=cm_cr_arp_d_gw_btm?ie=UTF8","Verified Purchase","TOZO","March 25, 2022","United States",[],0,,,,,,
"https://www.amazon.com/product-reviews/B09LD2D1TV?ie=UTF8&reviewerType=all_reviews&pageNumber=445","TAGRY Bluetooth Headphones True Wireless Earbuds 60H Playback LED Power Display Earphones with Wireless Charging Case IPX5 Waterproof in-Ear Earbuds with Mic for TV Smart Phone Computer Laptop Sports",4.5,"{""five_star"":24951,""four_star"":4480,""one_star"":1264,""three_star"":1631,""two_star"":771}",5,5,"******","B09LD2D1TV",33097,"Affordable","R1DRK6LGIHIWPC","Quick delivery. Simple instructions. Good fit","AH6IDDNP2DCUOISJBUQAZ2AHGTXA","https://www.amazon.com//gp/profile/amzn1.account.AH6IDDNP2DCUOISJBUQAZ2AHGTXA/ref=cm_cr_arp_d_gw_btm?ie=UTF8","Verified Purchase","TAGRY","September 19, 2022","United States",[],0,,,,,,
"https://www.amazon.com/Bluetooth-Headphones-True-Waterproof-Microphone-Workout-Black/dp/B08H1WNYTR/ref=sr_1_111?keywords=headphones&qid=1676645373&sr=8-111","occiam Wireless Earbuds Bluetooth Headphones 48H Play Back Earphones in Ear Waterproof with Microphone LED Display for Sports Running Workout Black",4.3,"{""five_star"":30573,""four_star"":5873,""one_star"":2989,""three_star"":2683,""two_star"":1681}",5,5,"Sta T*******d","B08H1WNYTR",43797,"So far so good","R28U8YBOIWQE6E","Use them to workout so far so good","AEPPCMKJJS6MXNANSLGLXIFLBZBQ","https://www.amazon.com//gp/profile/amzn1.account.AEPPCMKJJS6MXNANSLGLXIFLBZBQ/ref=cm_cr_arp_d_gw_btm?ie=UTF8","Verified Purchase","occiam","September 26, 2022","United States",,0,,,,,,
"https://www.amazon.com/Sennheiser-Professional-Over-Ear-Monitoring-Headphones/dp/B00IT0IHOY/ref=sr_1_300?keywords=headphones&qid=1676645334&sr=8-300","Sennheiser Professional HD 280 PRO Over-Ear Monitoring Headphones",4.6,"{""five_star"":7917,""four_star"":1661,""one_star"":403,""three_star"":608,""two_star"":360}",5,3,"William ** C***o","B00IT0IHOY",10950,"Listen and compare headphones before you buy. Don't just order online.","R2HLY4SZ1IBRHG","I purchased the Sennheiser HD 280PRO Headphones  (old model) to replace the same model which I had purchased about 15 years ago. When I listened with them for the first time I immediately had to raise the volume to 80-100 on the scale and even then the volume doen not compare to the 40-45 setting on my old ones. Big disappointment.","AGB33NTKOCXAH2TULDVQZSYAN3JQ","https://www.amazon.com//gp/profile/amzn1.account.AGB33NTKOCXAH2TULDVQZSYAN3JQ/ref=cm_cr_arp_d_gw_btm?ie=UTF8","Verified Purchase","Sennheiser Pro Audio","December 11, 2021","United States",[],0,,,,,,
"https://www.amazon.com/MIDOLA-Bluetooth-Wireless-Headphones-Cellphone/dp/B07DXP45Q7/ref=sr_1_172?keywords=headphones&qid=1676645331&sr=8-172","MIDOLA Headphones Bluetooth Wireless Kids Volume Limit 85dB /110dB Over Ear Foldable Noise Protection Headset AUX 3.5mm Cord Mic for Children Boy Girl Travel School Phone Pad Tablet PC Blue",4.5,"{""five_star"":7165,""four_star"":1431,""one_star"":511,""three_star"":626,""two_star"":296}",5,5,"Milton P*****z","B07DXP45Q7",10030,"Good product","R2DBKM72R1BXLF","Very good my kid is happy","AEOTXVHNXEMPRFLZBVXDWLWPZ4MQ","https://www.amazon.com//gp/profile/amzn1.account.AEOTXVHNXEMPRFLZBVXDWLWPZ4MQ/ref=cm_cr_arp_d_gw_btm?ie=UTF8","Verified Purchase","MIDOLA","January 29, 2019","United States",,0,,,,,,
"https://www.amazon.com/OneOdio-Adapter-Free-Headphones-Monitoring-Isolation/dp/B01F59T4HU/ref=sr_1_127?keywords=headphones&qid=1676645331&sr=8-127","OneOdio Hi-Res Over Ear Headphones for Studio Monitoring and Mixing, Sound Isolation, Protein Leather Earcups, 50mm Driver Unit, Wired Headphones for AMP Guitar Keyboard (Pro-50)",4.5,"{""five_star"":3443,""four_star"":789,""one_star"":162,""three_star"":273,""two_star"":120}",5,5,"Donald R*****d","B01F59T4HU",4788,"Excellent sound quality and build in a $50 headphone","R3O3L4TE9S05FH","For the price, these headphones have absolutely stellar sound quality with deep bass , great mids and non harsh highs. The sound envelopes you. There is some distortion if you crank these too high. If using a headphone amp middle volume or just slightly more is adequate for losing yourself, especially with vinyl. The make quality for an all plastic unit is also quite solid. The ear cups are extremely comfortable. The only drawback to build quality is in the way the cups tend to just flop everywhere when not on your head! There is no independent volume control.I enjoy these headphones quite a bit!","AHVDLBI25CWRIATCXB5DDOBG4WBA","https://www.amazon.com//gp/profile/amzn1.account.AHVDLBI25CWRIATCXB5DDOBG4WBA/ref=cm_cr_arp_d_gw_btm?ie=UTF8","Verified Purchase","OneOdio","June 2, 2021","United States",[],1,,,,,,
"https://www.amazon.com/product-reviews/B085RNVJ3P?ie=UTF8&reviewerType=all_reviews&pageNumber=15","Sony Noise Cancelling Headphones WHCH710N: Wireless Bluetooth Over the Ear Headset with Mic for Phone-Call, Black",4.4,"{""five_star"":14619,""four_star"":3743,""one_star"":1114,""three_star"":1582,""two_star"":797}",5,4,"Native T*****s","B085RNVJ3P",21851,"Great fit and nice sound","R2I7S7PL3Q1HC9","Loved the comfortable fit of these overearHeadphones! Although noise cancellation is not total there is still a good quality sound. Also they hold charge for an amazing amount of time. Really like these","AF4ZGQUCXLSNQWBUD5CVH3RJKXCA","https://www.amazon.com//gp/profile/amzn1.account.AF4ZGQUCXLSNQWBUD5CVH3RJKXCA/ref=cm_cr_arp_d_gw_btm?ie=UTF8","Verified Purchase","Sony","September 5, 2022","United States",[],3,,,,,,
"https://www.amazon.com/TOZO-Cancelling-Detection-Headphones-Waterproof/dp/B08L7D38ZL/ref=sr_1_119?keywords=headphones&qid=1676645331&sr=8-119","TOZO NC2 Hybrid Active Noise Cancelling Wireless Earbuds, in-Ear Detection Headphones, IPX6 Waterproof Bluetooth 5.2 Stereo Earphones, Immersive Sound Premium Deep Bass Headset, Black",4.3,"{""five_star"":17048,""four_star"":4674,""one_star"":1576,""three_star"":1992,""two_star"":1061}",5,5,"L. B************s","B08L7D38ZL",26350,"Manufacturers made good on poorly designed product","R27OYG1H2ZQP28","Revision:  the manufacturer reached out and sent a updated version. These fit!  ThanksOk at this price what can you expect. Couldn’t get correct for even with the smallest earpiece. Ear bud popped out and had to be hunted down on plane a couple times. Sound jumps from ear to ear at weirdest times. Charge holds for the minimum","AF3W2UXWCUSYPCNTZ3KL6MVE2ZOQ","https://www.amazon.com//gp/profile/amzn1.account.AF3W2UXWCUSYPCNTZ3KL6MVE2ZOQ/ref=cm_cr_arp_d_gw_btm?ie=UTF8","Verified Purchase","TOZO","June 19, 2022","United States",,0,,,,,,
"https://www.amazon.com/Plantronics-87300-41-RB-Voyager-Wireless-Bluetooth/dp/B00TJ0PGDS/ref=sr_1_77?keywords=headphones&qid=1676645331&sr=8-77","Plantronics 87300-41-RB Voyager Legend Wireless Bluetooth Headset - Black (Renewed)",4,"{""five_star"":819,""four_star"":201,""one_star"":276,""three_star"":130,""two_star"":106}",5,5,"Amazon C******r","B00TJ0PGDS",1532,"Plantronics Voyager Legend Wireless Bluetooth...","R2P9WX416PKVQ6","I really like these wireless Bluetooth headsets from Plantronics that I have bought several more.","AERXBQPWADL2DIG5VM43C6NIHLWA","https://www.amazon.com//gp/profile/amzn1.account.AERXBQPWADL2DIG5VM43C6NIHLWA/ref=cm_cr_arp_d_gw_btm?ie=UTF8","Verified Purchase","Amazon Renewed","July 25, 2015","United States",,0,,,,,,
"https://www.amazon.com/product-reviews/B018APC4LE?ie=UTF8&reviewerType=all_reviews&pageNumber=140","Otium Bluetooth Headphones,Wireless Earbuds IPX7 Waterproof Sports Earphones with Mic HD Stereo Sweatproof in-Ear Earbuds Gym Running Workout 10 Hour Battery Noise Cancelling Headsets",4.3,"{""five_star"":18890,""four_star"":4910,""one_star"":2587,""three_star"":2809,""two_star"":1558}",5,5,"******","B018APC4LE",30755,"Easy to Use and Great Sound!!","R1XQLJGS5R5E1B","Easy to use and pair up with devices. These headphones work just as described. I use them mainly at the gym and they are definitely sweat proof, they block all the noise so I can only hear my music, and they stay firmly in my ears which is critical with all the movement during workout. The extra ear buds in different sizes are great especially since one of my ear canals is slightly smaller than the other.  To top it off the sound quality on these is very good, I'm very happy with them all around which is why I think they deserve 5 stars.","AEFNQJTD4CMTSYITG5NIFOUN26ZA","https://www.amazon.com//gp/profile/amzn1.account.AEFNQJTD4CMTSYITG5NIFOUN26ZA/ref=cm_cr_arp_d_gw_btm?ie=UTF8","Verified Purchase","Otium","January 12, 2018","United States",[],1,,,,,,
"https://www.amazon.com/product-reviews/B00Q6P4CMA?ie=UTF8&reviewerType=all_reviews&pageNumber=145","Sony MDREX15LP in-Ear Earbud Headphones, Black, Model Number: MDREX15LP/B",4.3,"{""five_star"":19025,""four_star"":5301,""one_star"":1830,""three_star"":2584,""two_star"":1098}",5,3,"Amazon C******r","B00Q6P4CMA",29838,"Three Stars","R37JZYVXT9QDWA","Great sound. Left ear bud stopped working after a week.","AE7OEHUWGIGKJ5FUPAZXAYBLR4CQ","https://www.amazon.com//gp/profile/amzn1.account.AE7OEHUWGIGKJ5FUPAZXAYBLR4CQ/ref=cm_cr_arp_d_gw_btm?ie=UTF8","Verified Purchase","Sony","January 23, 2018","United States",[],0,,,,,,
"https://www.amazon.com/Sony-WH-1000XM4-Canceling-Headphones-phone-call/dp/B0863TXGM3/ref=sr_1_41?keywords=headphones&qid=1676645343&sr=8-41","Sony WH-1000XM4 Wireless Premium Noise Canceling Overhead Headphones with Mic for Phone-Call and Alexa Voice Control, Black",4.7,"{""five_star"":38523,""four_star"":4627,""one_star"":1479,""three_star"":1540,""two_star"":819}",5,3,"Scot * R*******n","B0863TXGM3",46980,"Multipoint","R9QNDIGJTXOK3","I really like these a lot. They feel great, they sound great, etc. I also have the M3 but I upgraded for multipoint pairing. Unfortunately, I didn't realize you can't use LDAC and multipoint at the same time. If Sony releases a firmware update to fix this, I'll raise my rating. Right now, only 3 stars.","AFTJEPIEG65CZBYW4Z5GTGQ5OPFA","https://www.amazon.com//gp/profile/amzn1.account.AFTJEPIEG65CZBYW4Z5GTGQ5OPFA/ref=cm_cr_arp_d_gw_btm?ie=UTF8","Verified Purchase","Sony","October 1, 2020","United States",,0,,,,,,
"https://www.amazon.com/Skullcandy-True-Wireless-Ear-Earbud/dp/B08GN9Q48R/ref=sr_1_155?keywords=headphones&qid=1676645331&sr=8-155","Skullcandy Jib True Wireless Earbud with Microphone / 22 Hour Battery Life / Use with iPhone and Android / Best for Gym, and Gaming / Bluetooth Earbud Headphones - Grey",4.3,"{""five_star"":12643,""four_star"":3056,""one_star"":1325,""three_star"":1356,""two_star"":691}",5,5,"alexis r********z","B08GN9Q48R",19069,"Excelent item","R3057PCBGR3AKC","Excelrnte profucto me gusta","AGH6RNHTNCIVNHD7RU3IPJSBFPEQ","https://www.amazon.com//gp/profile/amzn1.account.AGH6RNHTNCIVNHD7RU3IPJSBFPEQ/ref=cm_cr_arp_d_gw_btm?ie=UTF8","Verified Purchase","Skullcandy","August 18, 2021","United States",[],0,,,,,,
"https://www.amazon.com/Skullcandy-Noise-Isolating-Microphone-Hands-Free-Lightweight/dp/B07DGPSWY3/ref=sr_1_306?keywords=headphones&qid=1676645335&sr=8-306","Skullcandy Jib In-Ear Earbuds with Microphone - Miami",4.5,"{""five_star"":6305,""four_star"":1981,""one_star"":1392,""three_star"":1110,""two_star"":555}",5,1,"Amazon C******r","B07DGPSWY3",11344,"One Star","R2I9KJ5G1IUL95","Very bad product..!!!Its fake product its not original dont make  fool to people.",,"https://www.amazon.com/undefined","Verified Purchase","Skullcandy","August 17, 2017","India",,0,,,,,,
"https://www.amazon.com/product-reviews/B01LRK9DTA?ie=UTF8&reviewerType=all_reviews&pageNumber=123","Beats Solo3 Wireless On-Ear Headphones - Apple W1 Headphone Chip, Class 1 Bluetooth, 40 Hours of Listening Time - Rose Gold (Previous Model)",4.7,"{""five_star"":14085,""four_star"":1554,""one_star"":1047,""three_star"":650,""two_star"":382}",5,5,"Min***ve","B01LRK9DTA",17722,"love my beats","R3UGWM36OJ1BJC","I purchased my beats in white in 2017, the only thing I've had to replace are my ear cushions. which is understandable.","AG25T2M7MVSL7DN3EMX2P4AO5DYA","https://www.amazon.com//gp/profile/amzn1.account.AG25T2M7MVSL7DN3EMX2P4AO5DYA/ref=cm_cr_arp_d_gw_btm?ie=UTF8","Verified Purchase","Beats","June 12, 2019","United States",[],0,,,,,,
"https://www.amazon.com/Shokz-OpenMove-Headphones-Conduction-Sweatproof/dp/B09BW29FJS/ref=sr_1_185?keywords=headphones&qid=1676645331&sr=8-185","Shokz OpenMove - Open-Ear Bluetooth Sport Headphones - Bone Conduction Wireless Earphones - Sweatproof for Running and Workouts, with Sticker Pack (Grey)",4.5,"{""five_star"":4263,""four_star"":1061,""one_star"":222,""three_star"":365,""two_star"":137}",5,5,"alex M*********n","B09BW29FJS",6048,"Solid to hear both music and surroundings so clearly","R1JSJG8ESS9VU4","Good quality sound without fully isolating myself!","AH6TXHHSBBY5IEEZZAZIZX3DCV4A","https://www.amazon.com//gp/profile/amzn1.account.AH6TXHHSBBY5IEEZZAZIZX3DCV4A/ref=cm_cr_arp_d_gw_btm?ie=UTF8","Verified Purchase","SHOKZ","December 3, 2022","United States",[],0,,,,,,
"https://www.amazon.com/JBL-Tune-510BT-Ear-Headphones/dp/B08WM3LMJF/ref=sr_1_15?keywords=headphones&qid=1676645320&sr=8-15","JBL Tune 510BT: Wireless On-Ear Headphones with Purebass Sound - Black",4.6,"{""five_star"":19719,""four_star"":3629,""one_star"":725,""three_star"":1216,""two_star"":441}",5,5,"Ronald P***z","B08WM3LMJF",25730,"Great for work and to listen music","R2X3T80K07PW3I","This is awesome you can connect two devices at the same time.  I have my work computer and my phone.  I listen to music and If i receive a call on my computer It switch automatically to the call on the computer! This is a must have!","AG34U2GPUU35Y52VNXULDJ6IGLBQ","https://www.amazon.com//gp/profile/amzn1.account.AG34U2GPUU35Y52VNXULDJ6IGLBQ/ref=cm_cr_arp_d_gw_btm?ie=UTF8","Verified Purchase","JBL","February 22, 2022","United States",[],0,,,,,,
"https://www.amazon.com/Headphones-Otium-Waterproof-Sweatproof-Cancelling/dp/B018APC4LE/ref=sr_1_293?keywords=headphones&qid=1676645334&sr=8-293","Otium Bluetooth Headphones,Wireless Earbuds IPX7 Waterproof Sports Earphones with Mic HD Stereo Sweatproof in-Ear Earbuds Gym Running Workout 10 Hour Battery Noise Cancelling Headsets",4.3,"{""five_star"":18891,""four_star"":4909,""one_star"":2586,""three_star"":2809,""two_star"":1558}",5,5,"******","B018APC4LE",30754,"Good pair of headphones","RB2LCET6ICMAJ","I like these because they don’t have anything attached to the cord. So they’re a nothing bouncing on my shoulder or neck while I run. Super light weight and good sound. My wife and I both have a pair.","AFM6NGOPI36VJCA26LWOTD3NMT3Q","https://www.amazon.com//gp/profile/amzn1.account.AFM6NGOPI36VJCA26LWOTD3NMT3Q/ref=cm_cr_arp_d_gw_btm?ie=UTF8","Verified Purchase","Otium","July 28, 2020","United States",,0,,,,,,
"https://www.amazon.com/Microphone-Kimwood-Earphones-Headphones-Headphone/dp/B09DG4TXBJ/ref=sr_1_297?keywords=headphones&qid=1676645334&sr=8-297","Wired Earbuds with Microphone, Kimwood Wired Earphones in-Ear Headphones HiFi Stereo, Powerful Bass and Crystal Clear Audio, Compatible with iPhone, iPad, Android, Computer Most with 3.5mm Jack(Black)",4.4,"{""five_star"":3143,""four_star"":706,""one_star"":225,""three_star"":295,""two_star"":126}",5,5,"S. B****t","B09DG4TXBJ",4495,"Comfortable headphones and they sound amazing!!","RWENTHVGHQS8P","I really like these headphones. They are really comfortable in n my ear and they clarity of the sound is Amazing!! The price is awesome so dont think about it, just get you a pair.","AG2NOX3XTXBWDOBVKZ4KN5ATKQMA","https://www.amazon.com//gp/profile/amzn1.account.AG2NOX3XTXBWDOBVKZ4KN5ATKQMA/ref=cm_cr_arp_d_gw_btm?ie=UTF8","Verified Purchase","Kimwood","October 2, 2021","United States",[],0,,,,,,
"https://www.amazon.com/GOLREX-Bluetooth-Headphones-Earphones-Waterproof/dp/B0BGJ2NNJ2/ref=sr_1_71?keywords=headphones&qid=1676645331&sr=8-71","GOLREX Bluetooth Headphones Wireless Earbuds 36Hrs Playtime Wireless Charging Case Digital LED Display Over-Ear Earphones with Earhook Waterproof Headset with Mic for Sport Running Workout Black",4.7,"{""five_star"":3977,""four_star"":421,""one_star"":89,""three_star"":112,""two_star"":58}",5,5,"Amazon C******r","B0BGJ2NNJ2",4657,"great sound ear buds","R3BGOA6B8RWJD","great sounds, great battery life, comfort is pretty good","AFKGHQDXQUPBLVR6BIUUMPPG474A","https://www.amazon.com//gp/profile/amzn1.account.AFKGHQDXQUPBLVR6BIUUMPPG474A/ref=cm_cr_arp_d_gw_btm?ie=UTF8",,"GOLREX","February 9, 2023","United States",,0,,,,,,
