"url","product_name","product_rating","product_rating_object","product_rating_max","rating","author_name","asin","product_rating_count","review_header","review_id","review_text","author_id","author_link","badge","brand","review_posted_date","review_country","review_images","helpful_count","keyword","is_amazon_vine","is_verified","variant_asin","variant_name","videos"
"https://www.amazon.com/product-reviews/B076JDPH5D?ie=UTF8&reviewerType=all_reviews&pageNumber=100","iClever HS14 Kids Headphones, Headphones for Kids with 94dB Volume Limited for Boys Girls, Adjustable Headband, Foldable, Child Headphones on Ear for Study Tablet Airplane School, Black, Blue",4.6,"{""five_star"":14458,""four_star"":2828,""one_star"":624,""three_star"":1081,""two_star"":426}",5,5,"marie ** c*****e","B076JDPH5D",19418,"Adjustable to fit young adult up to adult head","R3SK6AOQGO038H","Great headphones, my greatest desire is for longer cords. Everything else is very good.","AFCQK5B3QK2RJVGLLFFSVM7D7ARA","https://www.amazon.com//gp/profile/amzn1.account.AFCQK5B3QK2RJVGLLFFSVM7D7ARA/ref=cm_cr_arp_d_gw_btm?ie=UTF8","Verified Purchase","iClever","December 29, 2018","United States",[],0,,,,,,
"https://www.amazon.com/JBL-Tune-510BT-Ear-Headphones/dp/B08WM3LMJF/ref=sr_1_15?keywords=headphones&qid=1676645320&sr=8-15","JBL Tune 510BT: Wireless On-Ear Headphones with Purebass Sound - Black",4.6,"{""five_star"":19718,""four_star"":3630,""one_star"":725,""three_star"":1216,""two_star"":440}",5,5,"******","B08WM3LMJF",25729,"Excelentes","R41FUOQ3H9K","Me gustaron mucho, para el precio son excelentes 😊🫶🏻",,"https://www.amazon.com/undefined","Verified Purchase","JBL","January 10, 2023","Italy",,0,,,,,,
"https://www.amazon.com/Beats-Solo3-Wireless-Ear-Headphones/dp/B01LRK9DTA/ref=sr_1_97?keywords=headphones&qid=1676645373&sr=8-97","Beats Solo3 Wireless On-Ear Headphones - Apple W1 Headphone Chip, Class 1 Bluetooth, 40 Hours of Listening Time - Rose Gold (Previous Model)",4.7,"{""five_star"":14085,""four_star"":1554,""one_star"":1047,""three_star"":650,""two_star"":382}",5,5,"DDE***S","B01LRK9DTA",17722,"Five Stars","RG54IT9MPCZVD","Bought two of these, just what my Grandchildren wanted","AGCGZDMMCV6J4Y4ZSNSUDZP4L2UQ","https://www.amazon.com//gp/profile/amzn1.account.AGCGZDMMCV6J4Y4ZSNSUDZP4L2UQ/ref=cm_cr_arp_d_gw_btm?ie=UTF8","Verified Purchase","Beats","April 29, 2017","United States",[],0,,,,,,
"https://www.amazon.com/Bluetooth-Headphones-Wireless-TUINYO-Memory-Protein/dp/B08RDXC62G/ref=sr_1_217?keywords=headphones&qid=1676645334&sr=8-217","TUINYO Bluetooth Headphones Wireless, Over Ear Stereo Wireless Headset 40H Playtime with deep bass, Soft Memory-Protein Earmuffs, Built-in Mic Wired Mode PC/Cell Phones/TV-White …",4.4,"{""five_star"":11454,""four_star"":2695,""one_star"":865,""three_star"":1220,""two_star"":568}",5,1,"Gab***l","B08RDXC62G",16800,"Broke after a week","R3HTNBKUOLMYJ5","Item was fine at first. I don't have big head, and I've never had a problem before with headphones but this one split down the middle after a week. Now they don't stay on my ears :/ If you don't have a small head or fine hair/a lot of hair, probably pass  on these. Could've been a great product other than this.","AEMSZ4GX33HAM33OIFHTKZPBRIDQ","https://www.amazon.com//gp/profile/amzn1.account.AEMSZ4GX33HAM33OIFHTKZPBRIDQ/ref=cm_cr_arp_d_gw_btm?ie=UTF8","Verified Purchase","TUINYO","November 27, 2021","United States",,0,,,,,,
"https://www.amazon.com/Bluetooth-Headphones-Cancelling-Earphones-Waterproof/dp/B09TN4MP6V/ref=sr_1_54?keywords=headphones&qid=1676645345&sr=8-54","Wireless Earbuds, Bluetooth 5.3 Earbuds Stereo Bass, Bluetooth Headphones in Ear Noise Cancelling Mic, Earphones IP7 Waterproof Sports, 32H Playtime USB C Mini Charging Case Ear Buds for Android iOS",4.3,"{""five_star"":8103,""four_star"":2255,""one_star"":744,""three_star"":1033,""two_star"":464}",5,5,"Luca **","B09TN4MP6V",12599,"Ottimo rapporto prezzo qualità","R3B9X9ZEWATHZC","Ho le cuffie da un po’ di tempo. Le uso per andare a correre o camminare. Comode nell’orecchio e non patiscono il sudore. Non sono un esperto ma la qualità del suono è ottima. La sincronizzazione è molto semplice, basta inserire le cuffie nel caricabatterie e si accoppiano. Non posso giudicare la batteria. Le uso mediamente per due ore e poi le ripongo nel caricabatterie. Quindi non so la reale durata. Prodotto consigliato",,"https://www.amazon.com/undefined","Verified Purchase","Jxrev","July 6, 2022","Germany",,0,,,,,,
"https://www.amazon.com/product-reviews/B09TN4MP6V?ie=UTF8&reviewerType=all_reviews&pageNumber=304","Wireless Earbuds, Bluetooth 5.3 Earbuds Stereo Bass, Bluetooth Headphones in Ear Noise Cancelling Mic, Earphones IP7 Waterproof Sports, 32H Playtime USB C Mini Charging Case Ear Buds for Android iOS",4.3,"{""five_star"":8103,""four_star"":2255,""one_star"":744,""three_star"":1033,""two_star"":464}",5,5,"Amazon K***e","B09TN4MP6V",12599,"Sehr gut","R15JM4I6BPN132","Es sind meine ersten In-Ear kabellose Kopfhörer. Sie gefallen mir bisher sehr gut. Die Ohren tun nach langem Tragen nicht weh und die Tonqualität finde ich für mich sehr gut.",,,"Verified Purchase","Jxrev","May 29, 2022","Germany",[],0,,,,,,
"https://www.amazon.com/product-reviews/B0006B486K?ie=UTF8&reviewerType=all_reviews&pageNumber=298","Koss KSC75 Portable Stereophone Headphones, Single, Standard Packaging White/Gray",4.3,"{""five_star"":4325,""four_star"":1434,""one_star"":450,""three_star"":656,""two_star"":471}",5,5,"Amanda B****r","B0006B486K",7337,"Five Stars","R3C4MUZDFUA79D","Works very well. Using them for the PSVR and have no complaints.","AELN6ELWYTZSQLUDR7ZZHFIGAZHA","https://www.amazon.com//gp/profile/amzn1.account.AELN6ELWYTZSQLUDR7ZZHFIGAZHA/ref=cm_cr_arp_d_gw_btm?ie=UTF8",,"Koss","November 19, 2017","United States",[],0,,,,,,
"https://www.amazon.com/JVC-HAS160B-Lightweight-Headband-Headphones/dp/B004JRYLG4/ref=sr_1_153?keywords=headphones&qid=1676645331&sr=8-153","JVC Black Flat and Foldable Colorful Flats On Ear Headphone with 3.94 foot Gold Plated Phone Slim Plug HAS160B",4.4,"{""five_star"":5685,""four_star"":1574,""one_star"":341,""three_star"":578,""two_star"":260}",5,4,"******","B004JRYLG4",8437,"Works well and they are very light. My husband ...","R57JQVAH1E1YG","Works well and they are very light.  My husband thinks  the cord should be a little longer, as it somewhat restricts his movement.","AGP7GKYZI5XV2COQQFATMBOPA4GA","https://www.amazon.com//gp/profile/amzn1.account.AGP7GKYZI5XV2COQQFATMBOPA4GA/ref=cm_cr_arp_d_gw_btm?ie=UTF8","Verified Purchase","JVC","December 23, 2016","United States",,0,,,,,,
"https://www.amazon.com/DOQAUS-Bluetooth-Headphones-Wireless-Microphone/dp/B08PY9LYQ8/ref=sr_1_50?keywords=headphones&qid=1676645345&sr=8-50","DOQAUS Bluetooth Headphones Over Ear, 52 Hours Playtime Wireless Headphones with 3 EQ Modes, Noise Isolating HiFi Stereo Headphones with Deep Bass, Microphone, Soft Earpads for Cellphone/PC (Black)",4.4,"{""five_star"":4671,""four_star"":1109,""one_star"":336,""three_star"":433,""two_star"":221}",5,5,"RANDALL V*****E","B08PY9LYQ8",6770,"Cool","R35AFUJC3LL7P9","Cool","AGN4ODEJT2SUYR2PMFWTSCNOWCUQ","https://www.amazon.com//gp/profile/amzn1.account.AGN4ODEJT2SUYR2PMFWTSCNOWCUQ/ref=cm_cr_arp_d_gw_btm?ie=UTF8","Verified Purchase","DOQAUS","July 21, 2021","United States",,0,,,,,,
"https://www.amazon.com/PANASONIC-Headphones-Integrated-Controller-Lightweight/dp/B00009RDIF/ref=sr_1_24?keywords=headphones&qid=1676645338&sr=8-24","Panasonic Stereo Headphones with XBS Port, Integrated Volume Controller and Lightweight Foldable Design – RP-HT227-K – Over the Ear Headphones (Black & Silver)",4.3,"{""five_star"":17192,""four_star"":4953,""one_star"":1614,""three_star"":2747,""two_star"":1225}",5,5,"Kindle C******r","B00009RDIF",27731,"Much nicer sound than I expected","R3EK4F07S5U3AO","They are comfortable to wear and lightweight as advertised.","/gp/profile/amzn1.account.AFMP5ZTZOSFEYCKRGTFJSJV7ZO7A","https://www.amazon.com//gp/profile/amzn1.account.AFMP5ZTZOSFEYCKRGTFJSJV7ZO7A","Verified Purchase","Panasonic","November 3, 2021","United States",,0,,,,,,
"https://www.amazon.com/PALOVUE-Headphones-Earphones-Microphone-Compatible/dp/B0B8DH5RXF/ref=sr_1_237?keywords=headphones&qid=1676645333&sr=8-237","PALOVUE USB C Headphones Earbuds, in-Ear Type C Magnetic Earphones with Microphone Compatible with Samsung Galaxy S22 S21 Ultra S20 FE Note 20 10, Google Pixel 7 6 5 4, One Plus 9 8 7T, Black",4.3,"{""five_star"":4794,""four_star"":1134,""one_star"":590,""three_star"":580,""two_star"":385}",5,5,"She***z","B0B8DH5RXF",7483,"Eacellent","R3L4RAOISGAF9Q","Excellent craftsmanship. Sounds clear and crisp.","AGO4D5KTVXXSIPL3QIEOH3C2F7UA","https://www.amazon.com//gp/profile/amzn1.account.AGO4D5KTVXXSIPL3QIEOH3C2F7UA/ref=cm_cr_arp_d_gw_btm?ie=UTF8","Verified Purchase","PALOVUE","April 1, 2019","United States",[],0,,,,,,
"https://www.amazon.com/Sennheiser-Professional-Over-Ear-Monitoring-Headphones/dp/B00IT0IHOY/ref=sr_1_300?keywords=headphones&qid=1676645334&sr=8-300","Sennheiser Professional HD 280 PRO Over-Ear Monitoring Headphones",4.6,"{""five_star"":7917,""four_star"":1661,""one_star"":403,""three_star"":608,""two_star"":360}",5,3,"Mark M******z","B00IT0IHOY",10950,"More than what I needed.","R2O2Q468PTAVTQ","Over kill, which is my fault","AG62VWWMKD3FU7WAQSAIWUCRQMUA","https://www.amazon.com//gp/profile/amzn1.account.AG62VWWMKD3FU7WAQSAIWUCRQMUA/ref=cm_cr_arp_d_gw_btm?ie=UTF8","Verified Purchase","Sennheiser Pro Audio","June 8, 2022","United States",[],0,,,,,,
"https://www.amazon.com/TOZO-NC9-Cancelling-Headphones-Waterproof/dp/B0B4VZYGBR/ref=sr_1_210?keywords=headphones&qid=1676645334&sr=8-210","TOZO NC9 2022 Version Hybrid Active Noise Cancelling Wireless Earbuds,in Ear Headphones IPX6 Waterproof Bluetooth 5.3 Stereo Earphones, Immersive Sound Premium Deep Bass Headset Matte Black",4.3,"{""five_star"":17482,""four_star"":4978,""one_star"":1638,""three_star"":2115,""two_star"":1142}",5,2,"Patricia C**y","B0B4VZYGBR",27356,"ANC/Transparency Mode/Volume not an upgrade","R1IHNJV8Z7D7QM","I already have two pairs of T12's and was looking for an upgrade, both in fit and also noise cancellation....it is hard to beat the T12's, however, the new design on the NC9's do fit better than them....however, the main thing I was paying for was the ANC/Transparency functions and there is a lot of work to do on that unless this was a bad pair....I notice from the reviews that others had this same problem....but the main issue is that the volume is just way lower at any given setting than the T12's....I am listening to Gaga right now at less than half volume, which is comfortable, however with the NC9's, you would have to turn the volume up to near full volume just to have anywhere close to this definition and sound....and this is in a quiet room with the ANC turned off!  Switching between ANC and Transparency, there is no difference in sound or volume at all....on the road, I don't hear any more noise with T12's than NC9's with ANC....TOZO, you have a great product in the T12, but IMO you have work to do on these NC9's, unless this was a bad pair that I bought!","/gp/profile/amzn1.account.AGD7DBJ24Z3FQBDS7KNDATPENOOQ","https://www.amazon.com//gp/profile/amzn1.account.AGD7DBJ24Z3FQBDS7KNDATPENOOQ","Verified Purchase","TOZO","May 16, 2021","United States",,0,,,,,,
"https://www.amazon.com/product-reviews/B08X1QWB9W?ie=UTF8&reviewerType=all_reviews&pageNumber=421","Skullcandy Dime True Wireless In-Ear Bluetooth Earbuds Compatible with iPhone and Android / Charging Case and Microphone / Great for Gym, Sports, and Gaming, IPX4 Water Dust Resistant - Black",4.2,"{""five_star"":27795,""four_star"":8019,""one_star"":2892,""three_star"":3862,""two_star"":1709}",5,1,"Khalid k**n","B08X1QWB9W",44278,"Worst thing on internet","R1YK0Z0G0X2CMA","Battery sucks",,,"Verified Purchase","Skullcandy","February 13, 2023","Canada",[],0,,,,,,
"https://www.amazon.com/Sonitum-Headset-Microphone-Comfortable-Connectivity/dp/B09JTTD2S4/ref=sr_1_139?keywords=headphones&qid=1676645331&sr=8-139","Sonitum Headset with Microphone - Noise Canceling Computer Headset for Office, Meetings, Chat- Comfortable Over-Ear PC Headphones with Rotating Mic- 3.5 Jack for Universal Connectivity (1 Pack)",4.3,"{""five_star"":2083,""four_star"":386,""one_star"":234,""three_star"":235,""two_star"":122}",5,5,"Karen B***n","B09JTTD2S4",3060,"Clarity of sound","R1RZBEAUDVDA18","Comfortable on the ears and head. Clarity of sound.","AE5VSKJCN5SBHMV6QSAXPRVNQLKQ","https://www.amazon.com//gp/profile/amzn1.account.AE5VSKJCN5SBHMV6QSAXPRVNQLKQ/ref=cm_cr_arp_d_gw_btm?ie=UTF8","Verified Purchase","Sonitum","August 5, 2022","United States",[],0,,,,,,
"https://www.amazon.com/Bluetooth-Over-Ear-Foldable-Headphones-Prolonged/dp/B07Z1P2LGL/ref=sr_1_53?keywords=headphones&qid=1676645345&sr=8-53","ZIHNIC Bluetooth Headphones Over-Ear, Foldable Wireless and Wired Stereo Headset Micro SD/TF, FM for Cell Phone,PC,Soft Earmuffs &Light Weight for Prolonged Wearing (Purple)",4.4,"{""five_star"":48669,""four_star"":11029,""one_star"":3206,""three_star"":4951,""two_star"":2151}",5,5,"Amazon C******r","B07Z1P2LGL",70007,"Works well and is inexpensive","R31YDN7BBRDFV9","For the money a pretty awesome product and comes in enough colors for both my girls.","AECE2QWIW3BPH6V4XRCKQJYXNNZQ","https://www.amazon.com//gp/profile/amzn1.account.AECE2QWIW3BPH6V4XRCKQJYXNNZQ/ref=cm_cr_arp_d_gw_btm?ie=UTF8","Verified Purchase","ZIHNIC","May 20, 2021","United States",,0,,,,,,
"https://www.amazon.com/Headphones-Samsung-Earphones-Earbuds-OnePlus/dp/B0B93YM4PC/ref=sr_1_249?keywords=headphones&qid=1676645334&sr=8-249","USB C Headphones for Samsung Galaxy S22 Ultra S21 FE S20 Z Flip 3 Fold 2 A53 USB C Earphones with Mic in-Ear Headphones Wired Earbuds USB Type C Earphones for iPad Pro Air Mini 6th Pixel 6A OnePlus 9",4.4,"{""five_star"":1029,""four_star"":275,""one_star"":94,""three_star"":100,""two_star"":49}",5,1,"Souleymane ***","B0B93YM4PC",1547,"Les écouteurs ne fonctionnent pas.","R1JQJC4JKSV5EN","Les écouteurs ne fonctionnent pas. Mauvaise expérience",,"https://www.amazon.com/undefined","Verified Purchase","BENEWY","January 28, 2023","Italy",,0,,,,,,
"https://www.amazon.com/product-reviews/B08X2JSMHZ?ie=UTF8&reviewerType=all_reviews&pageNumber=50","Tecno B1 Bluetooth Headphones, Bluetooth Earbuds Wireless with 38Hrs Playtime, Wireless Bluetooth Headphones for Sports, Sweatproof & IPX5 Waterproof Wireless Headphones（Black）",4.2,"{""five_star"":3018,""four_star"":834,""one_star"":395,""three_star"":408,""two_star"":230}",5,5,"Samuel W***s M****n","B08X2JSMHZ",4885,"Does what I wanted","R2VLH19CEJOXPO","I ues this for when I'm at work I jam to my music while working to make the day go faster blocks out noise well enough and lasts a good amount of time for battery life","AEF76AX33AUZKDTC746A7YO4FWUA","https://www.amazon.com//gp/profile/amzn1.account.AEF76AX33AUZKDTC746A7YO4FWUA/ref=cm_cr_arp_d_gw_btm?ie=UTF8","Verified Purchase","TECNO","November 5, 2021","United States",[],0,,,,,,
"https://www.amazon.com/Logitech-Headset-H390-Noise-Cancelling/dp/B000UXZQ42/ref=sr_1_27?keywords=headphones&qid=1676645338&sr=8-27","Logitech H390 Wired Headset, Stereo Headphones with Noise-Cancelling Microphone, USB, In-Line Controls, PC/Mac/Laptop - Black",4.4,"{""five_star"":32541,""four_star"":8158,""one_star"":2348,""three_star"":3407,""two_star"":1549}",5,4,"CAR***N","B000UXZQ42",48000,"Good headphone","R2W0JGJN016D2G","Good headphone","AE3R2AW5RONHXE7YPA65JGVPUIZA","https://www.amazon.com//gp/profile/amzn1.account.AE3R2AW5RONHXE7YPA65JGVPUIZA/ref=cm_cr_arp_d_gw_btm?ie=UTF8","Verified Purchase","Logitech","June 23, 2020","United States",[],0,,,,,,
"https://www.amazon.com/product-reviews/B09JL41N9C?ie=UTF8&reviewerType=all_reviews&pageNumber=94","Beats Fit Pro - True Wireless Noise Cancelling Earbuds - Apple H1 Headphone Chip, Compatible with Apple & Android, Class 1 Bluetooth®, Built-in Microphone, 6 Hours of Listening Time – Beats Black",4.5,"{""five_star"":13646,""four_star"":2307,""one_star"":812,""three_star"":1022,""two_star"":531}",5,5,"J. R*****o","B09JL41N9C",18318,"Nice Bluetooth headphones","R9JHFYTMJO9ZN","I bought these headphones after reading about them for months. I am so happy I did. The battery life is great, I have not gotten any complaints about the call quality and they are pretty comfortable to wear (I wore them for a little over 2 hours listening to an audio book and was happy with them)","AEJEFOVMZD2XS3JXHT4C3ZI4FGRQ","https://www.amazon.com//gp/profile/amzn1.account.AEJEFOVMZD2XS3JXHT4C3ZI4FGRQ/ref=cm_cr_arp_d_gw_btm?ie=UTF8","Verified Purchase","Beats","August 1, 2022","United States",[],0,,,,,,
"https://www.amazon.com/Bluetooth-Headphones-Earphones-Cancelling-Waterproof/dp/B0B65B14L1/ref=sr_1_208?keywords=headphones&qid=1676645373&sr=8-208","Wireless Earbud, Bluetooth 5.3 Headphones Deep Bass Bluetooth Earbud with 4 Mics, Bluetooth Earphones in Ear Noise Cancelling Wireless Headphones, IP7 Waterproof 42H Ear Buds, LED Display[New Upgrade]",4.6,"{""five_star"":4965,""four_star"":832,""one_star"":236,""three_star"":275,""two_star"":131}",5,5,"******","B0B65B14L1",6435,"As described!","R13MT1HEWE129W","These are great earphones. I got them for my daughter and she said they have great sound quality and are comfortable to wear. Thank you!",,"https://www.amazon.com/undefined","Verified Purchase","Drsaec","December 31, 2022","Germany",[],0,,,,,,
"https://www.amazon.com/Beats-Studio-Cancelling-Earbuds-Built-Bluetooth-Headphones/dp/B096SSCV5K/ref=sr_1_9?keywords=headphones&qid=1676645320&sr=8-9","Beats Studio Buds - True Wireless Noise Cancelling Earbuds - Compatible with Apple & Android, Built-in Microphone, IPX4 Rating, Sweat Resistant Earphones, Class 1 Bluetooth Headphones Red",4.4,"{""five_star"":40384,""four_star"":7711,""one_star"":3741,""three_star"":4115,""two_star"":2167}",5,1,"******","B096SSCV5K",58117,"Need to buy charger! Battery does not last 8 hours!","R1ZQKO8044UZ4A","I just purchased these to use at work. The description claimed the battery life on these is ""up to"" 8 hours so I thought these would be ideal for the workday. However, with a full charge they only last 4 hours. I have other styles of beats headphones and their sound quality/bass is much better. I do not recommend these. Furthermore, I would think an Apple product would come with an Apple charger. These had zero charge straight out of the package. I grabbed one of phone chargers to use, and to my surprise they do not fit this model. I had to purchase a USBC to USBA adapter to begin using these. I do not recommend.","AHOBJKOTOW2KXOBT3W3SAEHXYIBQ","https://www.amazon.com//gp/profile/amzn1.account.AHOBJKOTOW2KXOBT3W3SAEHXYIBQ/ref=cm_cr_arp_d_gw_btm?ie=UTF8","Verified Purchase","Beats","October 12, 2022","United States",,2,,,,,,
"https://www.amazon.com/product-reviews/B07RGZ5NKS?ie=UTF8&reviewerType=all_reviews&pageNumber=263","TOZO T6 True Wireless Earbuds Bluetooth 5.3 Headphones Touch Control with Wireless Charging Case IPX8 Waterproof Stereo Earphones in-Ear Built-in Mic Headset Premium Deep Bass Black (2022 Upgraded)",4.4,"{""five_star"":164900,""four_star"":40871,""one_star"":10316,""three_star"":16199,""two_star"":7487}",5,4,"******","B07RGZ5NKS",239771,"Works great.","RJUBFOMJAYTMN","Still a little larger than I would like but really like them still! Thank you","AEKU7J2EUQEC6CT4CAWR4V4OEOCA","https://www.amazon.com//gp/profile/amzn1.account.AEKU7J2EUQEC6CT4CAWR4V4OEOCA/ref=cm_cr_arp_d_gw_btm?ie=UTF8","Verified Purchase","TOZO","July 26, 2022","United States",[],0,,,,,,
"https://www.amazon.com/product-reviews/B098XGQS6G?ie=UTF8&reviewerType=all_reviews&pageNumber=57","Silensys E7 Active Noise Cancelling Headphones Bluetooth Headphones with Microphone Deep Bass Wireless Headphones Over Ear, Comfortable Protein Earpads, 30 Hours Playtime for Travel/Work, Black",4.4,"{""five_star"":3179,""four_star"":709,""one_star"":238,""three_star"":328,""two_star"":170}",5,1,"Mamma b**r","B098XGQS6G",4624,"Missing things","R3AXBAXBKGBYE3","Missing charge cord.Missing audio cable.Missing user guide.Appear to be used.Disappointed","AHTUBMRAS4EJFLJ3BBKPEHC3EIRQ","https://www.amazon.com//gp/profile/amzn1.account.AHTUBMRAS4EJFLJ3BBKPEHC3EIRQ/ref=cm_cr_arp_d_gw_btm?ie=UTF8","Verified Purchase","Silensys","February 10, 2023","United States",[],0,,,,,,
"https://www.amazon.com/Skullcandy-Crusher-Wireless-Over-Ear-Headphone/dp/B08FCGH2RL/ref=sr_1_22?keywords=headphones&qid=1676645338&sr=8-22","Skullcandy Crusher Evo Wireless Over-Ear Bluetooth Headphones for iPhone and Android with Mic / 40 Hour Battery Life / Extra Bass Tech / Best for Music, School, Workouts, and Gaming - Black",4.8,"{""five_star"":7597,""four_star"":829,""one_star"":172,""three_star"":222,""two_star"":82}",5,5,"Anthia C******n","B08FCGH2RL",8902,"6 months with these","R2MGET6G2JIAFG","And they held up great! Sounds really nice, and I loveeee the bass slider, the vibration feels nice, and the battery life is amazing. I charge it every 1 ½ to 2 weeks! Very much worth the money.",,"https://www.amazon.com/undefined","Verified Purchase","Skullcandy","June 5, 2021","Canada",,0,,,,,,
"https://www.amazon.com/product-reviews/B01M0GB8CC?ie=UTF8&reviewerType=all_reviews&pageNumber=75","Apple EarPods Headphones with Lightning Connector. Microphone with Built-in Remote to Control Music, Phone Calls, and Volume. Wired Earbuds for iPhone",4.6,"{""five_star"":154476,""four_star"":19982,""one_star"":6257,""three_star"":7516,""two_star"":2759}",5,5,"******","B01M0GB8CC",190986,"Love them, Must Buy!","R1A0SBEGOCKOI0","I know there are a lot of mixed reviews on them but from my experience they are amazing. I was skeptical at first because of the bad reviews and was praying they came well. I got them new out of the box brand new and looked as if no one used them. (But if someone did, good job making them look brand new). This is a must buy.","AEYTOSUURN4E5WIWAAVJVY7ISKMA","https://www.amazon.com//gp/profile/amzn1.account.AEYTOSUURN4E5WIWAAVJVY7ISKMA/ref=cm_cr_arp_d_gw_btm?ie=UTF8","Verified Purchase","Apple","February 22, 2022","United States","[""https://m.media-amazon.com/images/I/718PK1lxd+L._SY88.jpg""]",0,,,,,,
"https://www.amazon.com/Wireless-Bluetooth-Charging-Resistance-Connection/dp/B086P9HYCS/ref=sr_1_159?keywords=headphones&qid=1676645331&sr=8-159","JLab Go Air True Wireless Bluetooth Earbuds + Charging Case | Dual Connect | IP44 Sweat Resistance | Bluetooth 5.0 Connection | 3 EQ Sound Settings Signature, Balanced, Bass Boost… (Blue)",4.2,"{""five_star"":17891,""four_star"":5055,""one_star"":2145,""three_star"":2875,""two_star"":1323}",5,3,"alex r***l","B086P9HYCS",29289,"Not loud enough. Had to return","R25MBT3VVLVU13","Not loud enough. Had to return","AHTTGZZRUHR44B6BVLSDGT4ROK7A","https://www.amazon.com//gp/profile/amzn1.account.AHTTGZZRUHR44B6BVLSDGT4ROK7A/ref=cm_cr_arp_d_gw_btm?ie=UTF8","Verified Purchase","JLab","January 3, 2022","United States",,0,,,,,,
"https://www.amazon.com/JVC-HAS160B-Lightweight-Headband-Headphones/dp/B004JRYLG4/ref=sr_1_153?keywords=headphones&qid=1676645331&sr=8-153","JVC Black Flat and Foldable Colorful Flats On Ear Headphone with 3.94 foot Gold Plated Phone Slim Plug HAS160B",4.4,"{""five_star"":5685,""four_star"":1574,""one_star"":341,""three_star"":578,""two_star"":260}",5,5,"C P***z","B004JRYLG4",8438,"Affordable Sound Quality","R1RB3N3QPFDC0Y","Sound much better than my earbuds.","AGPXTBE3YTX4D6LXBMVL36NLF53A","https://www.amazon.com//gp/profile/amzn1.account.AGPXTBE3YTX4D6LXBMVL36NLF53A/ref=cm_cr_arp_d_gw_btm?ie=UTF8","Verified Purchase","JVC","April 14, 2020","United States",[],0,,,,,,
