"url","product_name","product_rating","product_rating_object","product_rating_max","rating","author_name","asin","product_rating_count","review_header","review_id","review_text","author_id","author_link","badge","brand","review_posted_date","review_country","review_images","helpful_count","keyword","is_amazon_vine","is_verified","variant_asin","variant_name","videos"
"https://www.amazon.com/product-reviews/B00009RDIF?ie=UTF8&reviewerType=all_reviews&pageNumber=96","Panasonic Stereo Headphones with XBS Port, Integrated Volume Controller and Lightweight Foldable Design – RP-HT227-K – Over the Ear Headphones (Black & Silver)",4.3,"{""five_star"":17192,""four_star"":4954,""one_star"":1614,""three_star"":2747,""two_star"":1225}",5,4,"Yar***10","B00009RDIF",27732,"Good Sound but Flimsy","R1GPTGAJ1J5DAM","I just got these headphones today, and they were a great deal on cyber Monday. They get 4 stars because the sound is really good for the price. Nice bass sound and good for canceling out my noisy office during lunch time.~Pros~-Good sound-long cord~Cons~Flimsy construction (they may break with lots of use, I'm only using during lunch at work and handling gently)Tight on my head (I have a larger head and they are a bit of a pinch)Overall I think they will work great, and I would recommend them for someone in a similar situation as me. I will update this if my thoughts change or it breaks.","AH3ACGYCZI67CSTIUJXTXOTWEGZA","https://www.amazon.com//gp/profile/amzn1.account.AH3ACGYCZI67CSTIUJXTXOTWEGZA/ref=cm_cr_arp_d_gw_btm?ie=UTF8","Verified Purchase","Panasonic","November 28, 2012","United States",[],0,,,,,,
"https://www.amazon.com/Headphones-Microphone-Compatible-Computers-Interface/dp/B08MC6PLT4/ref=sr_1_190?keywords=headphones&qid=1676645331&sr=8-190","Earbuds Headphones 5 in One Pack, Wired Earbud with Heavy Bass Stereo Noise Blocking, Microphone, Compatible with iPhone, Android Phones, Laptops, Computers, iPad or Any Device with 3.5mm Interface…",4.1,"{""five_star"":3824,""four_star"":1128,""one_star"":433,""three_star"":598,""two_star"":310}",5,5,"Cliente ** A****n","B08MC6PLT4",6293,"Like it","R6YFR0228ND5P","Is very difficult to find one that fit to my ear, this are perfect. Thank you.","AEDO2E3OYOMOSZ4JU4W5NZPHQLIQ","https://www.amazon.com//gp/profile/amzn1.account.AEDO2E3OYOMOSZ4JU4W5NZPHQLIQ/ref=cm_cr_arp_d_gw_btm?ie=UTF8","Verified Purchase","HUOMU","February 20, 2021","United States",,0,,,,,,
"https://www.amazon.com/product-reviews/B085296FLT?ie=UTF8&reviewerType=all_reviews&pageNumber=277","Beats Studio3 Wireless Noise Cancelling Over-Ear Headphones - Apple W1 Headphone Chip, Class 1 Bluetooth, 22 Hours of Listening Time, Built-in Microphone - Matte Black (Latest Model)",4.7,"{""five_star"":25725,""four_star"":2832,""one_star"":863,""three_star"":928,""two_star"":399}",5,5,"Client d******n","B085296FLT",30745,"Very nice","R3R7AH4XSDKJMG","allgood",,,"Verified Purchase","Beats","February 12, 2022","Canada",[],0,,,,,,
"https://www.amazon.com/product-reviews/B09JL41N9C?ie=UTF8&reviewerType=all_reviews&pageNumber=131","Beats Fit Pro - True Wireless Noise Cancelling Earbuds - Apple H1 Headphone Chip, Compatible with Apple & Android, Class 1 Bluetooth®, Built-in Microphone, 6 Hours of Listening Time – Beats Black",4.5,"{""five_star"":13646,""four_star"":2307,""one_star"":812,""three_star"":1022,""two_star"":531}",5,5,"******","B09JL41N9C",18318,"The best wireless headphones!","R3PGDONRQTWRP8","I have had others and this one by far is the best one. I love the sound and all it does overall! I am happy with this headphones and love the pink color also!","AGZ2CGOPUPZPK23ATQY53IKFFAQA","https://www.amazon.com//gp/profile/amzn1.account.AGZ2CGOPUPZPK23ATQY53IKFFAQA/ref=cm_cr_arp_d_gw_btm?ie=UTF8","Verified Purchase","Beats","June 16, 2022","United States",[],0,,,,,,
"https://www.amazon.com/product-reviews/B08G1XKY6N?ie=UTF8&reviewerType=all_reviews&pageNumber=42","Skullcandy Hesh ANC Wireless Over-Ear Noise Cancelling Bluetooth Headphones for iPhone and Android with Microphone / 22 Hour Battery Life / Best for Music, School, Workouts, Travel, and Gaming - White",4.5,"{""five_star"":3887,""four_star"":830,""one_star"":188,""three_star"":277,""two_star"":118}",5,5,"La. S***e","B08G1XKY6N",5300,"Good Replacement","R22CX0NHXUYF0Z","Love the sound and an adjustment to wireless for me.","AHNZKKY45ATOGFVIYETEHV3QTKWA","https://www.amazon.com//gp/profile/amzn1.account.AHNZKKY45ATOGFVIYETEHV3QTKWA/ref=cm_cr_arp_d_gw_btm?ie=UTF8","Verified Purchase","Skullcandy","April 18, 2021","United States",[],0,,,,,,
"https://www.amazon.com/Beats-Studio-Cancelling-Earbuds-Built-Bluetooth-Headphones/dp/B096SSCV5K/ref=sr_1_9?keywords=headphones&qid=1676645320&sr=8-9","Beats Studio Buds - True Wireless Noise Cancelling Earbuds - Compatible with Apple & Android, Built-in Microphone, IPX4 Rating, Sweat Resistant Earphones, Class 1 Bluetooth Headphones Red",4.4,"{""five_star"":40384,""four_star"":7711,""one_star"":3741,""three_star"":4115,""two_star"":2167}",5,1,"Irf***fri***","B096SSCV5K",58117,"Don’t buy it the case battery life is less then 24hrs","R3DS4XQDOEPJSC","The sounds is not what I was expecting pulse the battery life is not that great","AHRL6D3BTUPMUGQFH766J6B66QWA","https://www.amazon.com//gp/profile/amzn1.account.AHRL6D3BTUPMUGQFH766J6B66QWA/ref=cm_cr_arp_d_gw_btm?ie=UTF8","Verified Purchase","Beats","December 5, 2022","United States",,0,,,,,,
"https://www.amazon.com/Sony-MDREX15LP-Earbud-Headphones-Number/dp/B00Q6P4CMA/ref=sr_1_18?keywords=headphones&qid=1676645338&sr=8-18","Sony MDREX15LP in-Ear Earbud Headphones, Black, Model Number: MDREX15LP/B",4.3,"{""five_star"":19025,""four_star"":5301,""one_star"":1830,""three_star"":2584,""two_star"":1098}",5,1,"******","B00Q6P4CMA",29838,"Crap!","R2QX8PUUV1N2A2","I've got about 6-8 different ear buds and these are the first 'brand name' ones I got. They are also the worst sounding thing I own. Tinny, nothing from mid to lower tones. Low volume as you can't turn them up anymore. The paper work wants to get you to download an app to control the buds... why does everything want you to install an app?!? You shouldn't need an app for stupid ear buds. These can't be real sony brand, or something is wrong. Did I mention they sound like a tin can? Total crap! And why does everything say 'noise canceling'? I've not used these for calls but I don't understand how these can be noise canceling.","AHPP5ZXJMGVQUZXUIJNEKFA3RRSA","https://www.amazon.com//gp/profile/amzn1.account.AHPP5ZXJMGVQUZXUIJNEKFA3RRSA/ref=cm_cr_arp_d_gw_btm?ie=UTF8","Verified Purchase","Sony","December 11, 2022","United States",[],0,,,,,,
"https://www.amazon.com/wired-headphones-computer-laptop-wire-ear-noise/dp/B087JVV8FK/ref=sr_1_82?keywords=headphones&qid=1676645332&sr=8-82","Artix CL750 Wired Headphones with Mic – On-Ear Headphones, Wire Headphones, Laptop Headphones, Computer Headphones, Corded Headphones, Kids Headphones Wired, Noise Cancelling Headphones Over Ear 3.5mm",4.4,"{""five_star"":8908,""four_star"":2267,""one_star"":654,""three_star"":1040,""two_star"":392}",5,1,"Jaime B**o","B087JVV8FK",13261,"Didn't last an hour!","RGPE9HJJD4RU7","My daughter used it for less than hour and the sound went on it. Don't waste your money and time to return it. Disappointing as they look really nice.",,"https://www.amazon.com/undefined","Verified Purchase","ARTIX","September 23, 2022","Canada",[],1,,,,,,
"https://www.amazon.com/Wireless-Bluetooth-Headphones-Earphones-BMANI-VEAT00L/dp/B09CPDSNQM/ref=sr_1_86?keywords=headphones&qid=1676645332&sr=8-86","bmanl Wireless Earbuds Bluetooth Headphones 48hrs Play Back Sport Earphones with LED Display Over-Ear Buds with Earhooks Built-in Mic Headset for Workout Black BMANI-VEAT00L",4.5,"{""five_star"":12826,""four_star"":2300,""one_star"":763,""three_star"":904,""two_star"":464}",5,5,"Amazon C******r","B09CPDSNQM",17257,"Great Product","R23XTTSM2TQBAK","The best bang for you buck","AFUTZH66QHSE3AFTWUCLHIIUHX4Q","https://www.amazon.com//gp/profile/amzn1.account.AFUTZH66QHSE3AFTWUCLHIIUHX4Q/ref=cm_cr_arp_d_gw_btm?ie=UTF8","Verified Purchase","bmanl","September 29, 2022","United States",[],0,,,,,,
"https://www.amazon.com/Skullcandy-Dime-True-Wireless-Earbud/dp/B08X1QWB9W/ref=sr_1_281?keywords=headphones&qid=1676645334&sr=8-281","Skullcandy Dime True Wireless In-Ear Bluetooth Earbuds Compatible with iPhone and Android / Charging Case and Microphone / Great for Gym, Sports, and Gaming, IPX4 Water Dust Resistant - Black",4.2,"{""five_star"":27795,""four_star"":8019,""one_star"":2892,""three_star"":3862,""two_star"":1709}",5,3,"******","B08X1QWB9W",44278,"Cheap option","R2759LHHRB9H8V","These are quite practical. Lightweight, easy to use and pair. However, they are too quiet for my taste. Also, they glitch the connection very y easily, both with Android and IPhone, so not the best of the best. If you are short on budget they are ok. If you can afford a bit more, then don't get these.",,"https://www.amazon.com/undefined","Verified Purchase","Skullcandy","February 22, 2022","Mexico",[],0,,,,,,
"https://www.amazon.com/Headphones-Otium-Waterproof-Sweatproof-Cancelling/dp/B018APC4LE/ref=sr_1_293?keywords=headphones&qid=1676645334&sr=8-293","Otium Bluetooth Headphones,Wireless Earbuds IPX7 Waterproof Sports Earphones with Mic HD Stereo Sweatproof in-Ear Earbuds Gym Running Workout 10 Hour Battery Noise Cancelling Headsets",4.3,"{""five_star"":18890,""four_star"":4910,""one_star"":2587,""three_star"":2809,""two_star"":1558}",5,5,"Steve E******d","B018APC4LE",30755,"Pretty damn good headphones","R198MWL7G6PUVB","This is my third set of these headphones, not because they failed or anything, I just use this for working out and they get abused badly. Sound quality is pretty great, and they’re durable as hell.","AFTA5EAP6TNLXNLLA5EHCLWQ6V6Q","https://www.amazon.com//gp/profile/amzn1.account.AFTA5EAP6TNLXNLLA5EHCLWQ6V6Q/ref=cm_cr_arp_d_gw_btm?ie=UTF8","Verified Purchase","Otium","December 28, 2022","United States",[],0,,,,,,
"https://www.amazon.com/Audio-Technica-ATHM40x-Professional-Monitor-Headphones/dp/B00HVLUR54/ref=sr_1_98?keywords=headphones&qid=1676645373&sr=8-98","Audio-Technica ATH-M40x Professional Studio Monitor Headphone, Black, with Cutting Edge Engineering, 90 Degree Swiveling Earcups, Pro-grade Earpads/Headband, Detachable Cables Included",4.6,"{""five_star"":10699,""four_star"":2126,""one_star"":278,""three_star"":649,""two_star"":262}",5,4,"Amazon C******r","B00HVLUR54",14014,"Great sound.","RQZ38N0NX0M7P","The ATH m40x sound incredible. I find that the sound level though, is a little on the low side.  I Have to really turn up volume level to get to listening levels. Very good guality sound profile. You will hear things in your music that you might have missed before. Overall very happy.",,"https://www.amazon.com/undefined","Verified Purchase","Audio-Technica","September 7, 2020","United Kingdom",,0,,,,,,
"https://www.amazon.com/product-reviews/B073WN3W6M?ie=UTF8&reviewerType=all_reviews&pageNumber=143","JLab Neon Folding On-Ear Headphones | Wired Headphones | Tangle Free Cord | Noise Isolation | 40mm Neodymium Drivers | C3 Sound (Crystal Clear Clarity) | Black",4.4,"{""five_star"":10590,""four_star"":2438,""one_star"":710,""three_star"":1090,""two_star"":463}",5,5,"Michelle I***n","B073WN3W6M",15291,"Great","RULVHTCITATYW","Great set. Our boys love them","AG4PTRHTJ6RHPRFOV7JRD5LWTDDQ","https://www.amazon.com//gp/profile/amzn1.account.AG4PTRHTJ6RHPRFOV7JRD5LWTDDQ/ref=cm_cr_arp_d_gw_btm?ie=UTF8","Verified Purchase","JLab","June 12, 2020","United States",[],0,,,,,,
"https://www.amazon.com/product-reviews/B07F62W3TQ?ie=UTF8&reviewerType=all_reviews&pageNumber=202","Srhythm NC25 Active Noise Cancelling Headphones Bluetooth 5.0,ANC Stereo Headset Over-Ear with Hi-Fi,Mic,50H Playtime,Voice Assistant,Low Latency Game Mode",4.4,"{""five_star"":8701,""four_star"":2548,""one_star"":599,""three_star"":952,""two_star"":459}",5,5,"Amazon C******r","B07F62W3TQ",13259,"They really mean “all day comfort”","R2XXY5RHKJESKL","I was gifted these for my birthday, and I love them. The sound quality is really good — especially for relatively inexpensive headphones — and they’re easy to pair. The noise cancelling is awesome. But the best part is that you can easily and comfortably wear them all day: not only are these gentle on your ears and head, the battery is really impressive. I have only had them for a few weeks, so I don’t know how long that will last, but so far I’m really impressed. The carrying case took me a second to figure out how to get them back in in a way that fits (you’ve gotta bend as well as turn the earpiece flat, which was apparently beyond my abilities for a while), but it’s a great, small size that fits in my work bag easily so I can take these everywhere I go.","AEEGP3GYLHHWXOA7CG6O7EJSSSYQ","https://www.amazon.com//gp/profile/amzn1.account.AEEGP3GYLHHWXOA7CG6O7EJSSSYQ/ref=cm_cr_arp_d_gw_btm?ie=UTF8",,"Srhythm","November 7, 2021","United States",[],1,,,,,,
"https://www.amazon.com/Sennheiser-Professional-Over-Ear-Monitoring-Headphones/dp/B00IT0IHOY/ref=sr_1_300?keywords=headphones&qid=1676645334&sr=8-300","Sennheiser Professional HD 280 PRO Over-Ear Monitoring Headphones",4.6,"{""five_star"":7917,""four_star"":1661,""one_star"":403,""three_star"":608,""two_star"":360}",5,2,"******","B00IT0IHOY",10950,"Good sound and isolation, at the price of pain","R2RX9XJZVWENJF","After looking over countless reviews and words of wisdom, I decided to purchase the HD280 for the noted incredible sounds quality and isolation. However, I overlooked the ""vice grip"" reviews that some posted regarding comfort since so many others raved about the amazing comfort.When I received my package today I was extremely excited until I actually tried the headphones on. The material around the ears is not the soft leather-like material I had anticipated (like Bose AE2's) and rather is a though plastic feeling material that is not uncomfortable, but I definitely did not find it especially comfortable. The vice grip effect was really what killed these headphones to me. As a gamer and listener I wear headphones for extended periods of time and within 30 minutes of wearing these I had a ridiculous headache. Despite the fact that the sound quality these headphones provide is true amazing, it is impossible to enjoy the amazing sound quality when your head hurts extremely badly. I understand that this comes with the territory of having such amazing isolation and the closed, over the ear design, however this pain was truly unbearable. After trying them once more this afternoon, I packaged them back up and send them back to Amazon for a refund.I am very surprised that reviews similar to this were not popularized since the pain was (unfortunately) unbearable for me, perhaps I am the only one.I currently am using a Razer Carcharias and I was looking for an upgrade in terms of sound quality and isolation as well as a headphone that works in order settings besides at the computer, however I could not sacrifice comfort to the degree that the HD 280's did.I am unsure what headphones I was going to purchase (Sony MDRXB500?) next but in the future I will not buy headphones that I have no tried first.","AEMTM2OYBNGS4IPIVY3AUVOPFGCQ","https://www.amazon.com//gp/profile/amzn1.account.AEMTM2OYBNGS4IPIVY3AUVOPFGCQ/ref=cm_cr_arp_d_gw_btm?ie=UTF8","Verified Purchase","Sennheiser Pro Audio","January 25, 2012","United States",,5,,,,,,
"https://www.amazon.com/Silensys-Active-Noise-Cancelling-Headphones/dp/B098XGQS6G/ref=sr_1_88?keywords=headphones&qid=1676645332&sr=8-88","Silensys E7 Active Noise Cancelling Headphones Bluetooth Headphones with Microphone Deep Bass Wireless Headphones Over Ear, Comfortable Protein Earpads, 30 Hours Playtime for Travel/Work, Black",4.4,"{""five_star"":3179,""four_star"":709,""one_star"":238,""three_star"":328,""two_star"":170}",5,1,"******","B098XGQS6G",4624,"Don.t buy these","R35ROBR5AILU9G","After having 3 different pairs of the Cowin E7 that worked flawlessly, I got a pair of these. They look identical, but these crackle horribly while syncd up. I went back to a pair of ear buds while waiting for a new set of headphones. These are a garbage product and without a doubt NOT the same as the Cowin E7's. Avoid them and spend the extra $10 to get a better set of something else.","AFUCM7AMJD5SIHC2GNQ5J5BXMZOA","https://www.amazon.com//gp/profile/amzn1.account.AFUCM7AMJD5SIHC2GNQ5J5BXMZOA/ref=cm_cr_arp_d_gw_btm?ie=UTF8","Verified Purchase","Silensys","April 25, 2022","United States",[],0,,,,,,
"https://www.amazon.com/SP3060-Isolating-Earphones-Headphones-BlackBerry/dp/B0170RBJ9Q/ref=sr_1_189?keywords=headphones&qid=1676645331&sr=8-189","sephia SP3060 Earbuds Wired in Ear Headphones with Tangle-Free Cord Noise Isolating Earphones Deep Bass Case Ear Buds 3.5 mm Jack Plug",4.3,"{""five_star"":21196,""four_star"":5172,""one_star"":1622,""three_star"":2638,""two_star"":1129}",5,5,"jay***d","B0170RBJ9Q",31758,"The best sound.","R24C7EKEWJ8AKD","Sounds good and well built.","AHHKNIGPOVXLPMT34WYMBGGBUF4A","https://www.amazon.com//gp/profile/amzn1.account.AHHKNIGPOVXLPMT34WYMBGGBUF4A/ref=cm_cr_arp_d_gw_btm?ie=UTF8","Verified Purchase","sephia","July 16, 2021","United States",[],0,,,,,,
"https://www.amazon.com/TOZO-NC9-Cancelling-Headphones-Waterproof/dp/B0B4VZYGBR/ref=sr_1_296?keywords=headphones&qid=1676645334&sr=8-296","TOZO NC9 2022 Version Hybrid Active Noise Cancelling Wireless Earbuds,in Ear Headphones IPX6 Waterproof Bluetooth 5.3 Stereo Earphones, Immersive Sound Premium Deep Bass Headset Matte Black",4.3,"{""five_star"":17482,""four_star"":4978,""one_star"":1638,""three_star"":2116,""two_star"":1142}",5,5,"Susan * B*****s","B0B4VZYGBR",27358,"Easy Peasy","R20V58O904YCW7","Just received these and they connected seamlessly to my Galaxy Note 10+. I look forward to using them at work.","AGUSOASUSEPQP76MT5UO66ZSYBFA","https://www.amazon.com//gp/profile/amzn1.account.AGUSOASUSEPQP76MT5UO66ZSYBFA/ref=cm_cr_arp_d_gw_btm?ie=UTF8","Verified Purchase","TOZO","May 4, 2021","United States",[],0,,,,,,
"https://www.amazon.com/Wireless-Bluetooth-Headphones-Foldable-Headsets/dp/B08VNFD8FS/ref=sr_1_8?keywords=headphones&qid=1676645320&sr=8-8","PRTUKYT 6S Wireless Bluetooth Headphones Over Ear, Hi-Fi Stereo Foldable Wireless Stereo Headsets Earbuds with Built-in Mic, Volume Control, FM for Phone/PC (Black & Gold)",4.3,"{""five_star"":6485,""four_star"":1524,""one_star"":607,""three_star"":762,""two_star"":394}",5,3,"LUB***TE","B08VNFD8FS",9772,"Nice BUT fragile!","R1SBW67ECOADOK","SD card play feature a great feature. Sound quality decent, volume control very solid. Battery life really good too. However as I did yard work the third week of owning, they slipped off my head as they had before. But this particular time I felt them slipping and caught them in hand. They snapped. Wow. Broken hearted. Also they are substantially cheaper just a few weeks later. Metal headband is what I'm looking for next time.","AEINKEVUJDMDSO6XBGPR5YBC2J6Q","https://www.amazon.com//gp/profile/amzn1.account.AEINKEVUJDMDSO6XBGPR5YBC2J6Q/ref=cm_cr_arp_d_gw_btm?ie=UTF8","Verified Purchase","PRTUKYT","September 27, 2022","United States",[],0,,,,,,
"https://www.amazon.com/Perytong-Headphones-Bluetooth-Headband-Headphone/dp/B0BK7YR1D3/ref=sr_1_248?keywords=headphones&qid=1676645334&sr=8-248","Perytong Sleep Headphones Bluetooth Headband Wireless Headphone Headband for Side Sleepers - Headphones for Sleeping - Sleeping Headphones for Insomnia Nuit Travel,Gift for Women Men Mom Dad",4.3,"{""five_star"":29376,""four_star"":8745,""one_star"":2102,""three_star"":4103,""two_star"":1714}",5,4,"******","B0BK7YR1D3",46035,"Comfy & functional!","R2WMBXM4SQDDBW","I have trouble keeping earbuds in my ears, so this style is perfect for me! I love that it doubles as an ear warmer too when I go on walks! Very soft and comfortable. Sound quality is surprisingly good too. Easy to operate. My only complaint is that the control panel is front and center on the forehead. But it works okay to rotate that part to the back. Or I have even put a thicker ear warmer over it when I go on walks in the cold. Overall super happy with this purchase so far!","AEOOY6FXADZZ4ZT54RRLRWCY5XJA","https://www.amazon.com//gp/profile/amzn1.account.AEOOY6FXADZZ4ZT54RRLRWCY5XJA/ref=cm_cr_arp_d_gw_btm?ie=UTF8","Verified Purchase","Perytong","December 8, 2022","United States",[],0,,,,,,
"https://www.amazon.com/product-reviews/B01LRK9DTA?ie=UTF8&reviewerType=all_reviews&pageNumber=168","Beats Solo3 Wireless On-Ear Headphones - Apple W1 Headphone Chip, Class 1 Bluetooth, 40 Hours of Listening Time - Rose Gold (Previous Model)",4.7,"{""five_star"":14085,""four_star"":1554,""one_star"":1047,""three_star"":650,""two_star"":382}",5,3,"Antonio **","B01LRK9DTA",17722,"Great!","R3P0GDHUHKM3EG","Wish the headphones didn’t feel cheap. Could’ve been made with a more durable material than plastic. Makes it feel like you DON’T get what you pay for.","AET5OB32UXG6W7Y4XMKVWQ5LP2SQ","https://www.amazon.com//gp/profile/amzn1.account.AET5OB32UXG6W7Y4XMKVWQ5LP2SQ/ref=cm_cr_arp_d_gw_btm?ie=UTF8","Verified Purchase","Beats","September 12, 2018","United States",[],0,,,,,,
"https://www.amazon.com/TOZO-NC9-Cancelling-Headphones-Waterproof/dp/B0B4VZYGBR/ref=sr_1_296?keywords=headphones&qid=1676645334&sr=8-296","TOZO NC9 2022 Version Hybrid Active Noise Cancelling Wireless Earbuds,in Ear Headphones IPX6 Waterproof Bluetooth 5.3 Stereo Earphones, Immersive Sound Premium Deep Bass Headset Matte Black",4.3,"{""five_star"":17482,""four_star"":4978,""one_star"":1638,""three_star"":2116,""two_star"":1142}",5,5,"Ste***nie***","B0B4VZYGBR",27358,"Wow! GET THEM!!!!!","RTK8K3A06TGJ1","Wow! Amazing quality and value!!!! Love these so much! They totally rival the Samsung pro earbuds my husband has. Tozo is a fantastic brand with great customer service!","AFAJ2K5U7RCLB4LHJ7VXRZRUZ7AQ","https://www.amazon.com//gp/profile/amzn1.account.AFAJ2K5U7RCLB4LHJ7VXRZRUZ7AQ/ref=cm_cr_arp_d_gw_btm?ie=UTF8","Verified Purchase","TOZO","April 16, 2021","United States","[""https://images-na.ssl-images-amazon.com/images/I/91WxUm53Q7L._SY88.jpg"",""https://images-na.ssl-images-amazon.com/images/I/91c8eeG1aKL._SY88.jpg"",""https://images-na.ssl-images-amazon.com/images/I/91ivRbxpkyL._SY88.jpg""]",0,,,,,,
"https://www.amazon.com/Sennheiser-HD-650-Professional-Headphone/dp/B00018MSNI/ref=sr_1_186?keywords=headphones&qid=1676645331&sr=8-186","Sennheiser HD 650 - Audiophile Hi-Res Open Back Dynamic Headphone",4.7,"{""five_star"":2106,""four_star"":255,""one_star"":55,""three_star"":95,""two_star"":55}",5,5,"******","B00018MSNI",2568,"Great Headphones","R19OUKNREXJI4G","Beautiful headphones and worth every penny. Partners my Little Dot mkIV SE tube headphone amp perfectly. Prompt delivery and well packaged",,"https://www.amazon.com/undefined","Verified Purchase","Sennheiser Consumer Audio","December 3, 2014","United Kingdom",,2,,,,,,
"https://www.amazon.com/product-reviews/B00IT0IHOY?ie=UTF8&reviewerType=all_reviews&pageNumber=143","Sennheiser Professional HD 280 PRO Over-Ear Monitoring Headphones",4.6,"{""five_star"":7917,""four_star"":1661,""one_star"":403,""three_star"":608,""two_star"":360}",5,5,"Tbe***zzi***","B00IT0IHOY",10950,"My second Pair","R7S6HUM8G100H","I first purchased these 10 years ago (I still use them) I bought this pair as I new how good they were and my wife needed some good headphones.","AGCRQ2C2K3X4SILXGMXTMOQ7IKZQ","https://www.amazon.com//gp/profile/amzn1.account.AGCRQ2C2K3X4SILXGMXTMOQ7IKZQ/ref=cm_cr_arp_d_gw_btm?ie=UTF8","Verified Purchase","Sennheiser Pro Audio","September 28, 2018","United States",[],2,,,,,,
"https://www.amazon.com/product-reviews/B0006B486K?ie=UTF8&reviewerType=all_reviews&pageNumber=354","Koss KSC75 Portable Stereophone Headphones, Single, Standard Packaging White/Gray",4.3,"{""five_star"":4325,""four_star"":1434,""one_star"":450,""three_star"":656,""two_star"":471}",5,5,"Travis G*****t","B0006B486K",7337,"Crazy good for price","R1H7LGI7UM5RCI","I own a pair of SHP9500's, and I honestly prefer these more just because of the bass. They sound great, nothing can compete in this price range.",,,"Verified Purchase","Koss","October 12, 2021","Canada",[],0,,,,,,
"https://www.amazon.com/Headphones-Otium-Waterproof-Sweatproof-Cancelling/dp/B018APC4LE/ref=sr_1_293?keywords=headphones&qid=1676645334&sr=8-293","Otium Bluetooth Headphones,Wireless Earbuds IPX7 Waterproof Sports Earphones with Mic HD Stereo Sweatproof in-Ear Earbuds Gym Running Workout 10 Hour Battery Noise Cancelling Headsets",4.3,"{""five_star"":18890,""four_star"":4910,""one_star"":2587,""three_star"":2809,""two_star"":1558}",5,1,"John *","B018APC4LE",30755,"Look Elsewhere","R1QRLF17KCJFQY","No, just no! For me these headphones are awful. They never stay in my ear no matter how I adjust or alter them. You will find that if it wasn't for the hooks over your ears they would never stay on. Matter of fact, even with the over ear hooks they have fallen off my head multiple times during light physical activity. Just Don't!","AHDTSJF47RZNGDR2AW5ATE3L3VEQ","https://www.amazon.com//gp/profile/amzn1.account.AHDTSJF47RZNGDR2AW5ATE3L3VEQ/ref=cm_cr_arp_d_gw_btm?ie=UTF8","Verified Purchase","Otium","October 21, 2022","United States",[],0,,,,,,
