"url","product_name","product_rating","product_rating_object","product_rating_max","rating","author_name","asin","product_rating_count","review_header","review_id","review_text","author_id","author_link","badge","brand","review_posted_date","review_country","review_images","helpful_count","keyword","is_amazon_vine","is_verified","variant_asin","variant_name","videos"
"https://www.amazon.com/AKG-K240STUDIO-Semi-Open-Professional-Headphones/dp/B0001ARCFA/ref=sr_1_259?keywords=headphones&qid=1676645334&sr=8-259","AKG Pro Audio K240 STUDIO Over-Ear, Semi-Open, Professional Studio Headphones",4.6,"{""five_star"":7442,""four_star"":1695,""one_star"":296,""three_star"":579,""two_star"":255}",5,3,"******","B0001ARCFA",10267,"Buen sonido, mala descripcion del producto","R2D85DIF5ZW6N5","La relacion calidad precio es muy buena y de hecho suenan genial, planos, pero se trata de eso, sonido natural y claro, son muy comodos.Peeero, los compre en lugar de otros por que segun lei en los comentarios traian de regalo otro cble y otras almoadillas de tercio`pelo, ideales para el verano, pero no ha sido asi, me enviaron otros , pero vienen igual y no puedo seguirn con las devoluciones, ya que los necesito para editar sonido, ademas MUCHO OJO, yo ingrese 60€ porque asi me hacian una bonificacion previa de 8€, como asi fue, pero si los devuelvo pierdo esos 8€, asi que cuidado que yo ingrese antes de comprarlos 60€ que amazon tuvo en su poder para cuando hiciera la compra de lo que fuera y luego si devuelves pierdes la promocion.No he quedado satisfecho.",,"https://www.amazon.com/undefined","Verified Purchase","AKG","October 13, 2021","United Kingdom",,1,,,,,,
"https://www.amazon.com/product-reviews/B002LBSEQS?ie=UTF8&reviewerType=all_reviews&pageNumber=166","Samson Semi Open-Back Studio Reference Headphones, Black, Over Ear (SR850)",4.6,"{""five_star"":4580,""four_star"":1137,""one_star"":202,""three_star"":378,""two_star"":180}",5,3,"Jay***  (***the***","B002LBSEQS",6477,"Samson headphones","R2WJ2DJMYKP0CG","Not bad. This is the last time I will pay for cheap headphones. Over the years I have probably spent more money on cheap headphones than anything else. Some were more expensive than others. I think I have sensitive ears and require a level of quality I can’t afford! I’m really serious about my music and I want my masters to sound as good as possible. If you are reading this just save up for a better pair. visit a music store if you can. UPDATE: I took my own advice and went to a store. The real problem has been that I need my ear to befree of the covers because it becomes painful. I think it’s taken me far too long to figure this out! Now,you can save time :)",,,"Verified Purchase","Samson","September 16, 2018","Canada",[],1,,,,,,
"https://www.amazon.com/Bluetooth-Headphones-Cancelling-Earphones-Waterproof/dp/B09TN4MP6V/ref=sr_1_54?keywords=headphones&qid=1676645345&sr=8-54","Wireless Earbuds, Bluetooth 5.3 Earbuds Stereo Bass, Bluetooth Headphones in Ear Noise Cancelling Mic, Earphones IP7 Waterproof Sports, 32H Playtime USB C Mini Charging Case Ear Buds for Android iOS",4.3,"{""five_star"":8103,""four_star"":2255,""one_star"":744,""three_star"":1033,""two_star"":464}",5,5,"******","B09TN4MP6V",12599,"Worth the price!!","R2PZCP42RVA32G","Absolutely love these earbuds. I've had them for 2 months and haven't even had to charge them yet!! Super worth the money!!","AEVKOYMHV3OMBPJKX3NH22LWH3GQ","https://www.amazon.com//gp/profile/amzn1.account.AEVKOYMHV3OMBPJKX3NH22LWH3GQ/ref=cm_cr_arp_d_gw_btm?ie=UTF8","Verified Purchase","Jxrev","January 4, 2023","United States",,0,,,,,,
"https://www.amazon.com/SP3060-Isolating-Earphones-Headphones-BlackBerry/dp/B0170RBJ9Q/ref=sr_1_189?keywords=headphones&qid=1676645331&sr=8-189","sephia SP3060 Earbuds Wired in Ear Headphones with Tangle-Free Cord Noise Isolating Earphones Deep Bass Case Ear Buds 3.5 mm Jack Plug",4.3,"{""five_star"":21196,""four_star"":5172,""one_star"":1622,""three_star"":2638,""two_star"":1129}",5,4,"Jacob **","B0170RBJ9Q",31758,"Great Earbuds","R3IDVAT7B8G86V","product arrived on time and as advertised. good earphones for music.","AHHHWDJD7364JXOMJKR4EALW66RA","https://www.amazon.com//gp/profile/amzn1.account.AHHHWDJD7364JXOMJKR4EALW66RA/ref=cm_cr_arp_d_gw_btm?ie=UTF8","Verified Purchase","sephia","April 21, 2020","United States",,0,,,,,,
"https://www.amazon.com/Sennheiser-HD-450BT-Bluetooth-Cancellation/dp/B083WRNNR3/ref=sr_1_46?keywords=headphones&qid=1676645343&sr=8-46","Sennheiser HD 450BT Bluetooth 5.0 Wireless Headphone with Active Noise Cancellation - 30-Hour Battery Life, USB-C Fast Charging, Virtual Assistant Button, Foldable - White",4.2,"{""five_star"":2990,""four_star"":919,""one_star"":298,""three_star"":464,""two_star"":256}",5,3,"******","B083WRNNR3",4927,"Complete failures","R3TNQBMLUXU1NQ","I purchased these for my son because of the reviews and the quality of the name.I wish I had done more research. The quality is actually good, but I have multiple issues with these headphones.When my son started using them, he complained that he could only wear them for an hour before they started hurting. Since he is nine, I assumed he was just wearing them a little tight.After about a month he quit using them completely, so I started to use them and gave him a pair of Wyze headphones.After wearing them once, I totally agree with him. First, the padding on the headband is not enough. It would almost be better not to have any since what is there is not enough to matter. In addition to this, the ear cups are so small, they do not actually fit around your ears, but pretty much pin your ears to your head. After a little while of wearing them, the top of your head AND your ears hurt!Moving from the uncomfortable, we go on to the buttons. Whomever thought that it was a good idea to have so many buttons on one ear should be fired. There are five buttons. The power button, volume up/down, a multi-function button that pushes left right and in and another button right next to it. They are also extremely close together. When wearing thin gloves, good luck trying to hit one button. Also, the power button has to be pressed 3 seconds to be turned on, more, it goes into pairing mode, less, no dice. The only indication that they are on is a tiny single click that sounds like static.Next, these headphones do allow you to pair to two different devices, but don't expect multipoint. They are not. Adding to this, if are connected to two devices and walk away from one, a kind voice tells you that they disconnected, and will continue to say it every 20 or 30 seconds and NOT stop. Usually by the 4th or 5th reminder, I turn the headphones ofd and back on. This does fix that. I even emailed support about this and got a generic answer that pretty much said they were working properly.With all of this in mind, these are FAR from worth the price.I have a pair of Sony's and a pair of Wyze. The Sony headphones have better noise cancellation and are far more comfortable for the same price. The Wyze are also far more comfortable, have better noise cancellation, better functionality and only cost $50.","AHMWA5IGV2T3NO2NLJL5EA34635Q","https://www.amazon.com//gp/profile/amzn1.account.AHMWA5IGV2T3NO2NLJL5EA34635Q/ref=cm_cr_arp_d_gw_btm?ie=UTF8","Verified Purchase","Sennheiser Consumer Audio","January 29, 2021","United States",[],0,,,,,,
"https://www.amazon.com/Logitech-Headset-H390-Noise-Cancelling/dp/B000UXZQ42/ref=sr_1_27?keywords=headphones&qid=1676645338&sr=8-27","Logitech H390 Wired Headset, Stereo Headphones with Noise-Cancelling Microphone, USB, In-Line Controls, PC/Mac/Laptop - Black",4.4,"{""five_star"":32541,""four_star"":8158,""one_star"":2348,""three_star"":3407,""two_star"":1549}",5,5,"Santanta M****s","B000UXZQ42",48000,"Great pair of reasonably priced headphones.","R2XGMHVC6Q0L1F","The product offers what is said in the description.","AGFUZJXSFE3K7R3HOFMDH5OTJF2Q","https://www.amazon.com//gp/profile/amzn1.account.AGFUZJXSFE3K7R3HOFMDH5OTJF2Q/ref=cm_cr_arp_d_gw_btm?ie=UTF8","Verified Purchase","Logitech","March 7, 2020","United States",[],0,,,,,,
"https://www.amazon.com/Logitech-Headset-H390-Noise-Cancelling/dp/B000UXZQ42/ref=sr_1_27?keywords=headphones&qid=1676645338&sr=8-27","Logitech H390 Wired Headset, Stereo Headphones with Noise-Cancelling Microphone, USB, In-Line Controls, PC/Mac/Laptop - Black",4.4,"{""five_star"":32540,""four_star"":8158,""one_star"":2348,""three_star"":3407,""two_star"":1549}",5,4,"Rox*** Mü***r","B000UXZQ42",47999,"Good quality","R3P4MHWIK25P41","It's ok for the price but it's not really noise canceling but it works nicely","AFNYM6YXSNT2EEUIFZTEPNHFHDYA","https://www.amazon.com//gp/profile/amzn1.account.AFNYM6YXSNT2EEUIFZTEPNHFHDYA/ref=cm_cr_arp_d_gw_btm?ie=UTF8","Verified Purchase","Logitech","October 21, 2022","United States",,0,,,,,,
"https://www.amazon.com/TOZO-T6-Bluetooth-Headphones-Waterproof/dp/B07RGZ5NKS/ref=sr_1_37?keywords=headphones&qid=1676645343&sr=8-37","TOZO T6 True Wireless Earbuds Bluetooth 5.3 Headphones Touch Control with Wireless Charging Case IPX8 Waterproof Stereo Earphones in-Ear Built-in Mic Headset Premium Deep Bass Black (2022 Upgraded)",4.4,"{""five_star"":164895,""four_star"":40870,""one_star"":10315,""three_star"":16199,""two_star"":7488}",5,4,"Mike S*****y","B07RGZ5NKS",239763,"Better than most","RU8LDJ9XJZ8IV","Easy to pair. Fits the ear well. Good enough sound for the price. I would recommend.","AGYZ4T35FNCOAWBALOGW3QC7W3ZA","https://www.amazon.com//gp/profile/amzn1.account.AGYZ4T35FNCOAWBALOGW3QC7W3ZA/ref=cm_cr_arp_d_gw_btm?ie=UTF8","Verified Purchase","TOZO","May 13, 2022","United States",,0,,,,,,
"https://www.amazon.com/product-reviews/B076JDPH5D?ie=UTF8&reviewerType=all_reviews&pageNumber=36","iClever HS14 Kids Headphones, Headphones for Kids with 94dB Volume Limited for Boys Girls, Adjustable Headband, Foldable, Child Headphones on Ear for Study Tablet Airplane School, Black, Blue",4.6,"{""five_star"":14458,""four_star"":2828,""one_star"":624,""three_star"":1081,""two_star"":426}",5,5,"Robyn *","B076JDPH5D",19418,"Highly recommend!!","R371SHSODSG7E4","These are so great! Sound quality is good and the cord is wrapped in strong material so it's almost impossible to ruin. They are a God send if you're sick of having to hear Blippi day after day 😂","AEDSHFPW3AEEIEBPARATIF265SUA","https://www.amazon.com//gp/profile/amzn1.account.AEDSHFPW3AEEIEBPARATIF265SUA/ref=cm_cr_arp_d_gw_btm?ie=UTF8","Verified Purchase","iClever","June 8, 2020","United States",[],0,,,,,,
"https://www.amazon.com/TOZO-Cancelling-Detection-Headphones-Waterproof/dp/B08L7D38ZL/ref=sr_1_119?keywords=headphones&qid=1676645331&sr=8-119","TOZO NC2 Hybrid Active Noise Cancelling Wireless Earbuds, in-Ear Detection Headphones, IPX6 Waterproof Bluetooth 5.2 Stereo Earphones, Immersive Sound Premium Deep Bass Headset, Black",4.3,"{""five_star"":17048,""four_star"":4674,""one_star"":1576,""three_star"":1992,""two_star"":1061}",5,5,"Dean C***g","B08L7D38ZL",26350,"Nice addition to the Tozo ANC Product Line!","R2VMLNURQ0I77U","The media could not be loaded.
                
            
                
            
            
        
    
    








  
  
     These TOZO NC2 earphones with ANC look sleek and come with multi-sizes ear buds for a superior fit. Originally I didn't really like the extended stems but they actually aren't obtrusive or look awkard when worn.I particularly like the sound quality. Better bass and the ANC also worked better than a previous model I had. Since I do a lot of outdoors activities with lots of street noises, it's really great to be able to listen to music and podcasts without constantly having to adjust the volume level.","AHEJCZXXJWC7AVNRJR74NBVGGAPQ","https://www.amazon.com//gp/profile/amzn1.account.AHEJCZXXJWC7AVNRJR74NBVGGAPQ/ref=cm_cr_arp_d_gw_btm?ie=UTF8","Verified Purchase","TOZO","June 10, 2021","United States",,1,,,,,,
"https://www.amazon.com/Headphones-Earphones-Magnetic-Canceling-Microphone/dp/B09ZV1KQ3F/ref=sr_1_160?keywords=headphones&qid=1676645331&sr=8-160","USB C Headphones,USB Type C Earphones Wired Earbuds Magnetic Noise Canceling in-Ear Headset with Microphone for iPad Pro Samsung Galaxy S22 S21 Ultra S20 FE Note 10 20 Pixel 5 4a 3a XL Oneplus 9 8T",4.3,"{""five_star"":797,""four_star"":145,""one_star"":79,""three_star"":64,""two_star"":47}",5,5,"******","B09ZV1KQ3F",1132,"Great Deal on quality sound","RYAM6JH84JQ5Y","It came in a cool little case, I also liked that the buds are magnetic, hardly ever gets tangled. If you are an audiophile, you will enjoy these.","AGGEDCQEEUYZUXYVUK6C3OENZIJQ","https://www.amazon.com//gp/profile/amzn1.account.AGGEDCQEEUYZUXYVUK6C3OENZIJQ/ref=cm_cr_arp_d_gw_btm?ie=UTF8","Verified Purchase","UNOLYO","December 16, 2022","United States",[],0,,,,,,
"https://www.amazon.com/product-reviews/B01N5VHLUG?ie=UTF8&reviewerType=all_reviews&pageNumber=96","Philips Fidelio X2HR Over-Ear Open-Air Headphone 50mm Drivers- Black",4.6,"{""five_star"":5194,""four_star"":926,""one_star"":124,""three_star"":301,""two_star"":122}",5,5,"Bar***osi***","B01N5VHLUG",6667,"Merveilleux","R1NOMYA8DGU3I5","Peut-être le meilleur casque que j’ai jamais testé et eu en ma possession. Un confort d’écoute, et une restitution du son ma foi magnifique. Jamais épuisé d’écouter avec ce casque, pas de douleur au niveau auriculaire après de longues heures d’écoutes. Je ne peux que conseiller l’achat de ce casque au demeurant très peu onéreux vis-à-vis de certains concurrents bien connus et au combien autant voir bien mieux en équivalence.",,,"Verified Purchase","Philips Audio","October 23, 2022","Spain",[],0,,,,,,
"https://www.amazon.com/Sonitum-Headset-Microphone-Comfortable-Connectivity/dp/B09JTTD2S4/ref=sr_1_139?keywords=headphones&qid=1676645331&sr=8-139","Sonitum Headset with Microphone - Noise Canceling Computer Headset for Office, Meetings, Chat- Comfortable Over-Ear PC Headphones with Rotating Mic- 3.5 Jack for Universal Connectivity (1 Pack)",4.3,"{""five_star"":2083,""four_star"":386,""one_star"":234,""three_star"":235,""two_star"":122}",5,5,"******","B09JTTD2S4",3060,"Just what I needed","R3RR13TRR9BFYF","Item is still holding up to my  daily abuse","AEK2RB2FP4T7CZQGIFLUC5B37RFQ","https://www.amazon.com//gp/profile/amzn1.account.AEK2RB2FP4T7CZQGIFLUC5B37RFQ/ref=cm_cr_arp_d_gw_btm?ie=UTF8","Verified Purchase","Sonitum","April 18, 2022","United States",,0,,,,,,
"https://www.amazon.com/Sony-Noise-Cancelling-Headphones-WHCH710N/dp/B085RNVJ3P/ref=sr_1_133?keywords=headphones&qid=1676645331&sr=8-133","Sony Noise Cancelling Headphones WHCH710N: Wireless Bluetooth Over the Ear Headset with Mic for Phone-Call, Black",4.4,"{""five_star"":14619,""four_star"":3743,""one_star"":1114,""three_star"":1582,""two_star"":797}",5,5,"Robert W*****s","B085RNVJ3P",21851,"they work great","R3NSQBRUXZ0MH9","for my grandson and he loves them","AGZMFYYUYUQQZ7F7MVKUA5ROFFEA","https://www.amazon.com//gp/profile/amzn1.account.AGZMFYYUYUQQZ7F7MVKUA5ROFFEA/ref=cm_cr_arp_d_gw_btm?ie=UTF8","Verified Purchase","Sony","January 4, 2022","United States",[],0,,,,,,
"https://www.amazon.com/Skullcandy-Dime-True-Wireless-Earbud/dp/B08X1QWB9W/ref=sr_1_281?keywords=headphones&qid=1676645334&sr=8-281","Skullcandy Dime True Wireless In-Ear Bluetooth Earbuds Compatible with iPhone and Android / Charging Case and Microphone / Great for Gym, Sports, and Gaming, IPX4 Water Dust Resistant - Black",4.2,"{""five_star"":27794,""four_star"":8019,""one_star"":2892,""three_star"":3860,""two_star"":1708}",5,1,"MARIO **","B08X1QWB9W",44274,"BATTERY NOT GOOD","R1JHAHAGDBB3QV","Left side battery will run for 3 hours and right side will last for 4 hours. Will not complete a full 8 hour work day.","AGHUEB3HWZLSZVGXQHGMWGQRSJ6A","https://www.amazon.com//gp/profile/amzn1.account.AGHUEB3HWZLSZVGXQHGMWGQRSJ6A/ref=cm_cr_arp_d_gw_btm?ie=UTF8","Verified Purchase","Skullcandy","January 1, 2022","United States",,0,,,,,,
"https://www.amazon.com/product-reviews/B0001ARCFA?ie=UTF8&reviewerType=all_reviews&pageNumber=164","AKG Pro Audio K240 STUDIO Over-Ear, Semi-Open, Professional Studio Headphones",4.6,"{""five_star"":7442,""four_star"":1695,""one_star"":296,""three_star"":579,""two_star"":255}",5,5,"Hwang ** S**g","B0001ARCFA",10267,"Five Stars","RWHO9N4S83FT1","good~ item","AGDAZSWI3DLZKGWZVHS4HTYT3EGQ","https://www.amazon.com//gp/profile/amzn1.account.AGDAZSWI3DLZKGWZVHS4HTYT3EGQ/ref=cm_cr_arp_d_gw_btm?ie=UTF8","Verified Purchase","AKG","January 4, 2016","United States",[],0,,,,,,
"https://www.amazon.com/Audio-Technica-ATHM40x-Professional-Monitor-Headphones/dp/B00HVLUR54/ref=sr_1_98?keywords=headphones&qid=1676645373&sr=8-98","Audio-Technica ATH-M40x Professional Studio Monitor Headphone, Black, with Cutting Edge Engineering, 90 Degree Swiveling Earcups, Pro-grade Earpads/Headband, Detachable Cables Included",4.6,"{""five_star"":10699,""four_star"":2126,""one_star"":278,""three_star"":649,""two_star"":262}",5,5,"luis z****a","B00HVLUR54",14014,"Los mejores auriculares calidad-precio","RXKFH0HCKZ3CQ","Auriculares para monitorear audio, dan una respuesta de frecuencias plana, pero lo suficiente para ser nítida y conservadora, a mi parecer me agrada más el sonido que en los m50x, si tú intencion son unos audiculares con un excelente sonido equilibrado, de acústica cerrada con buen aislamiento de ruido, sin ser algo fenomenal estos son para ti, pero si quieres una escucha más musical y divertida con un alce en graves debes ir por los m50x",,"https://www.amazon.com/undefined","Verified Purchase","Audio-Technica","August 7, 2019","Canada",,0,,,,,,
"https://www.amazon.com/product-reviews/B07Z1P2LGL?ie=UTF8&reviewerType=all_reviews&pageNumber=348","ZIHNIC Bluetooth Headphones Over-Ear, Foldable Wireless and Wired Stereo Headset Micro SD/TF, FM for Cell Phone,PC,Soft Earmuffs &Light Weight for Prolonged Wearing (Purple)",4.4,"{""five_star"":48668,""four_star"":11030,""one_star"":3206,""three_star"":4951,""two_star"":2151}",5,5,"Kri***l","B07Z1P2LGL",70007,"Decent for what you pay","R30ZZYQZOJ39O9","I like them very useful and battery life is great","AGPXTOKVQ6PVYHRN2PLKRR6FPZ7Q","https://www.amazon.com//gp/profile/amzn1.account.AGPXTOKVQ6PVYHRN2PLKRR6FPZ7Q/ref=cm_cr_arp_d_gw_btm?ie=UTF8","Verified Purchase","ZIHNIC","July 24, 2021","United States",[],0,,,,,,
"https://www.amazon.com/product-reviews/B06WD4WL75?ie=UTF8&reviewerType=all_reviews&pageNumber=56","NENOS Kids Headphones Children’s Headphones for Kids Toddler Headphones Limited Volume (Lavender)",4.6,"{""five_star"":8123,""four_star"":1433,""one_star"":431,""three_star"":552,""two_star"":272}",5,2,"Rom***t","B06WD4WL75",10807,"Poorly-built, awful sound quality, and the volume's a bit high.","RFET9Q3IUWUSO","More than the 93 dbs that this put out, the fragile build, and the tear-away construction, these headphones suffer from having terrible sound quality.  It's like those pneumatic earphones they used to give away for free on airplanes.In fact, those airplane earphones are in every way superior to these, as they made no pretensions to being anything other than disposable.","AF7POHNKNJT5C5XLIIONHNI3DC6A","https://www.amazon.com//gp/profile/amzn1.account.AF7POHNKNJT5C5XLIIONHNI3DC6A/ref=cm_cr_arp_d_gw_btm?ie=UTF8","Verified Purchase","NENOS","November 14, 2020","United States",[],0,,,,,,
"https://www.amazon.com/Soundcore-Headphones-Crystal-Clear-Cancelling-Lightweight/dp/B086L8WF4D/ref=sr_1_221?keywords=headphones&qid=1676645334&sr=8-221","Soundcore Anker Life U2 Bluetooth Neckband Headphones with 24 H Playtime, 10 mm Drivers, Crystal-Clear Calls with CVC 8.0, USB-C Fast Charging, Foldable & Lightweight Build, IPX7 Waterproof",4.3,"{""five_star"":4009,""four_star"":1050,""one_star"":351,""three_star"":448,""two_star"":260}",5,1,"xay***m","B086L8WF4D",6118,"Broke Less Than 4 Months","R3DEHKNWVHYK90","Great headset until the on / off switch ceased too work as the button will not press.  Now it is useless.Pretty annoyed as this is the 3rd Soundcore product I own.","AERG6XU3TYPHSOETUTAE3X2PJX5Q","https://www.amazon.com//gp/profile/amzn1.account.AERG6XU3TYPHSOETUTAE3X2PJX5Q/ref=cm_cr_arp_d_gw_btm?ie=UTF8","Verified Purchase","Soundcore","February 15, 2023","United States",,0,,,,,,
"https://www.amazon.com/Beats-Solo3-Wireless-Ear-Headphones/dp/B07YVZ15SK/ref=sr_1_4?keywords=headphones&qid=1676645320&sr=8-4","Beats Solo3 Wireless On-Ear Headphones - Apple W1 Headphone Chip, Class 1 Bluetooth, 40 Hours of Listening Time, Built-in Microphone - Satin Silver (Latest Model)",4.7,"{""five_star"":51401,""four_star"":5568,""one_star"":1712,""three_star"":1732,""two_star"":818}",5,2,"She***ce","B07YVZ15SK",61231,"Not worth it. It disconnects for no reason","R2Q1XIPMC02HZU","Not worth it. It disconnects for no reason","AEEXS7CT2KJ7C5ZN4GPWVZBWIBPA","https://www.amazon.com//gp/profile/amzn1.account.AEEXS7CT2KJ7C5ZN4GPWVZBWIBPA/ref=cm_cr_arp_d_gw_btm?ie=UTF8","Verified Purchase","Beats","June 19, 2022","United States",,0,,,,,,
"https://www.amazon.com/product-reviews/B087JVV8FK?ie=UTF8&reviewerType=all_reviews&pageNumber=136","Artix CL750 Wired Headphones with Mic – On-Ear Headphones, Wire Headphones, Laptop Headphones, Computer Headphones, Corded Headphones, Kids Headphones Wired, Noise Cancelling Headphones Over Ear 3.5mm",4.4,"{""five_star"":8908,""four_star"":2267,""one_star"":654,""three_star"":1040,""two_star"":392}",5,2,"Amazon C******r","B087JVV8FK",13261,"Sounds OK","RS3TM16IOWPST","OK for cheap set till I save for better pair but after a few hours hurt my ears but for general use they would be fine",,,"Verified Purchase","ARTIX","October 18, 2021","Italy",[],0,,,,,,
"https://www.amazon.com/Shokz-OpenMove-Headphones-Conduction-Sweatproof/dp/B09BW29FJS/ref=sr_1_167?keywords=headphones&qid=1676645331&sr=8-167","Shokz OpenMove - Open-Ear Bluetooth Sport Headphones - Bone Conduction Wireless Earphones - Sweatproof for Running and Workouts, with Sticker Pack (Grey)",4.5,"{""five_star"":4263,""four_star"":1061,""one_star"":222,""three_star"":365,""two_star"":137}",5,5,"Conrad W*****i","B09BW29FJS",6048,"Great Product . Great price.","RRF5HOF6YNNEJ","I'm using it for couple of days and I'm very happy . Comfortable to wear and easy to use.","AE5B3M55EHJPUF4263ZVFXXIHXVA","https://www.amazon.com//gp/profile/amzn1.account.AE5B3M55EHJPUF4263ZVFXXIHXVA/ref=cm_cr_arp_d_gw_btm?ie=UTF8","Verified Purchase","SHOKZ","May 25, 2022","United States",[],0,,,,,,
"https://www.amazon.com/Sony-WH-XB910N-Cancelling-Headphones-Microphone/dp/B09CG2P4Z2/ref=sr_1_85?keywords=headphones&qid=1676645332&sr=8-85","Sony WH-XB910N Extra BASS Noise Cancelling Headphones, Wireless Bluetooth Over The Ear Headset with Microphone and Alexa Voice Control, Blue (Amazon Exclusive)",4.5,"{""five_star"":4519,""four_star"":945,""one_star"":208,""three_star"":297,""two_star"":141}",5,2,"Ross M******s","B09CG2P4Z2",6110,"Extremely disappointed…","R1O3LSUKJGKW0L","I’m not going to be around the bush here these headphones are not better than the Sony MDR-XB950N1. These are more quiet and have alot LESS bass. You dont get as much detail when listening to rock music either. On the N1s you can hear more detail with the bass on max than you can with these with the bass on zero. Extremely disappointed","AFVJP4A2ZUG5X3B6ETFBKVM2TOFQ","https://www.amazon.com//gp/profile/amzn1.account.AFVJP4A2ZUG5X3B6ETFBKVM2TOFQ/ref=cm_cr_arp_d_gw_btm?ie=UTF8","Verified Purchase","Sony","January 27, 2022","United States",[],0,,,,,,
"https://www.amazon.com/PowerLocus-Wireless-Bluetooth-Headphones-Microphone/dp/B06XT8L1YF/ref=sr_1_28?keywords=headphones&qid=1676645338&sr=8-28","PowerLocus Wireless Bluetooth Over-Ear Stereo Foldable Headphones, Wired Headsets with Built-in Microphone for iPhone, Samsung, LG, iPad (Rose Gold)",4.5,"{""five_star"":15942,""four_star"":3876,""one_star"":985,""three_star"":1707,""two_star"":718}",5,4,"Alw***Pla***","B06XT8L1YF",23225,"Good for the price!!","R2HI5LH9R47N81","Simple to set and use. Until now great product used daily!","AFDHZUKU2FA5HURRCGKFCRQXLO5Q","https://www.amazon.com//gp/profile/amzn1.account.AFDHZUKU2FA5HURRCGKFCRQXLO5Q/ref=cm_cr_arp_d_gw_btm?ie=UTF8","Verified Purchase","PowerLocus","September 24, 2021","United States",[],0,,,,,,
"https://www.amazon.com/Skullcandy-Push-Active-Wireless-Earbud/dp/B08X1V7V92/ref=sr_1_242?keywords=headphones&qid=1676645334&sr=8-242","Skullcandy Push Active True Wireless In-Ear Bluetooth Earbud, Use with iPhone and Android with Charging Case and Mic, Great for Gym, Sports, and Gaming, IP55 Water and Dust Resistant - Orange/Black",4.1,"{""five_star"":2401,""four_star"":650,""one_star"":375,""three_star"":324,""two_star"":202}",5,1,"Ari S*****r","B08X1V7V92",3952,"Won't disconnect","R11G7Z95IUDLJJ","These sound fine. I've had earbuds that sound as good and battery lasts as long for half the price. I don't use most of the Skullcandy features. Spotify connect notification won't go away when these are paired to your phone. The thing that really gets to me is the right earbud won't disconnect unless I set it in the case just right. Even then half the time it just reconnects. After a couple months of this it's become pretty infuriating. Why can't it just work the way it's supposed to. I paid enough money they it should. Not worth the cost considering","AHJEJH7MLYQX23I4U75N4GCFTT3Q","https://www.amazon.com//gp/profile/amzn1.account.AHJEJH7MLYQX23I4U75N4GCFTT3Q/ref=cm_cr_arp_d_gw_btm?ie=UTF8","Verified Purchase","Skullcandy","October 10, 2022","United States",[],0,,,,,,
